category,product_custom_name,asin,country_code,product_title,review_url,review_rating,review_date,reviewer_url,reviewer_name,reviewer_id,review_title,review_text,review_verified,variation_asin,deleted,deleted_datetime,product_attributes,amazon_review_id
,,B005JU5V6E,US,"Bosch ICON 21A Wiper Blade, Up to 40% Longer Life* - 21"" (Pack of 1)",https://www.amazon.com/gp/customer-reviews/R2OUUNGEFTNJ30,3.0,2018-06-28,https://www.amazon.com/gp/profile/amzn1.account.AGBOPLJ73K6TZNHQ3D6H75FCIWXQ/ref=cm_cr_arp_d_gw_btm?ie=UTF8,O,AGBOPLJ73K6TZNHQ3D6H75FCIWXQ,Three Stars,Within 6 months already started to get streaking.,Yes,,Not Deleted,,,R2OUUNGEFTNJ30
,,B005JU5V6E,US,"Bosch ICON 21A Wiper Blade, Up to 40% Longer Life* - 21"" (Pack of 1)",https://www.amazon.com/gp/customer-reviews/R2OB9CQXPQCTYV,3.0,2018-06-22,https://www.amazon.com/gp/profile/amzn1.account.AETOUEQAYVLUQPA3XUB45MPO3WRA/ref=cm_cr_arp_d_gw_btm?ie=UTF8,DC,AETOUEQAYVLUQPA3XUB45MPO3WRA,Not very impressed,Not very impressed. Worked well for the first month but then started streaking (like pretty much cheaper brands.) Wasn't expecting it from Bosch.,Yes,,Not Deleted,,,R2OB9CQXPQCTYV
,,B005JU5V6E,US,"Bosch ICON 21A Wiper Blade, Up to 40% Longer Life* - 21"" (Pack of 1)",https://www.amazon.com/gp/customer-reviews/R1GR6K604QGTWS,5.0,2018-06-21,https://www.amazon.com/gp/profile/amzn1.account.AFKM3BRIGQ3FLKI3M7S52VO4Z6UQ/ref=cm_cr_arp_d_gw_btm?ie=UTF8,Oliver,AFKM3BRIGQ3FLKI3M7S52VO4Z6UQ,As described,Fits,Yes,,Not Deleted,,,R1GR6K604QGTWS
,,B005JU5V6E,US,"Bosch ICON 21A Wiper Blade, Up to 40% Longer Life* - 21"" (Pack of 1)",https://www.amazon.com/gp/customer-reviews/R1TC7YH5AFC2AA,4.0,2018-06-20,https://www.amazon.com/gp/profile/amzn1.account.AHEVCSLV2PTZPGFQM7VYFZXXVYBA/ref=cm_cr_arp_d_gw_btm?ie=UTF8,Dawnann Murray,AHEVCSLV2PTZPGFQM7VYFZXXVYBA,Would've given 5 but I just bought this same one ...,"Would've given 5 but I just bought this same one a few months ago and the end fell off,they are the best",Yes,,Not Deleted,,,R1TC7YH5AFC2AA
,,B005JU5V6E,US,"Bosch ICON 21A Wiper Blade, Up to 40% Longer Life* - 21"" (Pack of 1)",https://www.amazon.com/gp/customer-reviews/R1ACIZ2FBTY35J,1.0,2018-06-19,https://www.amazon.com/gp/profile/amzn1.account.AF76HRKXHYYJS6THIYP7Z2AFE6IQ/ref=cm_cr_arp_d_gw_btm?ie=UTF8,Joshua,AF76HRKXHYYJS6THIYP7Z2AFE6IQ,One Star,did not fit as advertised . could not return. still sitting unopened on the shelf.,Yes,,Not Deleted,,,R1ACIZ2FBTY35J
,,B005JU5V6E,US,"Bosch ICON 21A Wiper Blade, Up to 40% Longer Life* - 21"" (Pack of 1)",https://www.amazon.com/gp/customer-reviews/R1REQ15EHKKC2E,1.0,2018-06-18,https://www.amazon.com/gp/profile/amzn1.account.AHJQML5FLXIFVENK3ZGA43IJTTXA/ref=cm_cr_arp_d_gw_btm?ie=UTF8,History Buff,AHJQML5FLXIFVENK3ZGA43IJTTXA,Don't provide longer life.,Not worth the money.  They do not provide longer life than a cheaper blade.,Yes,,Not Deleted,,,R1REQ15EHKKC2E
,,B005JU5V6E,US,"Bosch ICON 21A Wiper Blade, Up to 40% Longer Life* - 21"" (Pack of 1)",https://www.amazon.com/gp/customer-reviews/R1IG0YEDK8HO9E,5.0,2018-06-14,https://www.amazon.com/gp/profile/amzn1.account.AF7C7Q2VBAXP4A37L466SHR6ZETA/ref=cm_cr_arp_d_gw_btm?ie=UTF8,Montov,AF7C7Q2VBAXP4A37L466SHR6ZETA,So easy a caveman can do it :),My dealer said i needed new wipers at my last oil change. After reading reviews i decided on these for my 2016 dodge charger. Installation was so easy. I hate reading instructions & im def not going to watch a video. Ultimate test since it is about to rain.,Yes,,Not Deleted,,,R1IG0YEDK8HO9E
,,B005JU5V6E,US,"Bosch ICON 21A Wiper Blade, Up to 40% Longer Life* - 21"" (Pack of 1)",https://www.amazon.com/gp/customer-reviews/R209VFVDJGW1CX,5.0,2018-06-14,https://www.amazon.com/gp/profile/amzn1.account.AFAEI7GWZZXLSZCFLWHC522UOWJQ/ref=cm_cr_arp_d_gw_btm?ie=UTF8,peter j.,AFAEI7GWZZXLSZCFLWHC522UOWJQ,Five Stars,Excellent.,Yes,,Not Deleted,,,R209VFVDJGW1CX
,,B005JU5V6E,US,"Bosch ICON 21A Wiper Blade, Up to 40% Longer Life* - 21"" (Pack of 1)",https://www.amazon.com/gp/customer-reviews/RVX5UNB7FI1EJ,5.0,2018-06-13,https://www.amazon.com/gp/profile/amzn1.account.AF4WQYIS54RCMKCU4W4OTSHUM3YA/ref=cm_cr_arp_d_gw_btm?ie=UTF8,Dan L.,AF4WQYIS54RCMKCU4W4OTSHUM3YA,Five Stars,"I purchased this for my Ferrari F430.  Very well designed, fits perfectly.",Yes,,Not Deleted,,,RVX5UNB7FI1EJ
,,B005JU5V6E,US,"Bosch ICON 21A Wiper Blade, Up to 40% Longer Life* - 21"" (Pack of 1)",https://www.amazon.com/gp/customer-reviews/R1EQRJUV6M5VFH,5.0,2018-06-11,https://www.amazon.com/gp/profile/amzn1.account.AHR5LVJMRWQ756BFEMJD3MLP2Y6Q/ref=cm_cr_arp_d_gw_btm?ie=UTF8,Thomas,AHR5LVJMRWQ756BFEMJD3MLP2Y6Q,Five Stars,Great!,Yes,,Not Deleted,,,R1EQRJUV6M5VFH
,,B005JU5V6E,US,"Bosch ICON 21A Wiper Blade, Up to 40% Longer Life* - 21"" (Pack of 1)",https://www.amazon.com/gp/customer-reviews/RWOO3OOP1BNW0,5.0,2018-06-09,https://www.amazon.com/gp/profile/amzn1.account.AG6GFU5ZTFZD5JE2WDDVRO7CT6XA/ref=cm_cr_arp_d_gw_btm?ie=UTF8,QWP,AG6GFU5ZTFZD5JE2WDDVRO7CT6XA,Easy to install,Been using these for years and are a reference standard. Outstanding lifespan and clarity. Easy to install.,Yes,,Not Deleted,,,RWOO3OOP1BNW0
,,B005JU5V6E,US,"Bosch ICON 21A Wiper Blade, Up to 40% Longer Life* - 21"" (Pack of 1)",https://www.amazon.com/gp/customer-reviews/R382UERUB1BQ61,3.0,2018-06-07,https://www.amazon.com/gp/profile/amzn1.account.AHZFAYFMSXZBBUHCZKWDLHZ2LYSA/ref=cm_cr_arp_d_gw_btm?ie=UTF8,Julia Bell,AHZFAYFMSXZBBUHCZKWDLHZ2LYSA,A little long - works as expected,A little long for my windshield (even though it is advertised as the appropriate size for my vehicle).  Does clean the windshield well.,Yes,,Not Deleted,,,R382UERUB1BQ61
,,B005JU5V6E,US,"Bosch ICON 21A Wiper Blade, Up to 40% Longer Life* - 21"" (Pack of 1)",https://www.amazon.com/gp/customer-reviews/R25W12M65YEC5J,5.0,2018-05-30,https://www.amazon.com/gp/profile/amzn1.account.AE4COSQA4TYIPQIX2TK33LRZMCMQ/ref=cm_cr_arp_d_gw_btm?ie=UTF8,Nick W,AE4COSQA4TYIPQIX2TK33LRZMCMQ,Best wipers out there!,"These are great wipers! They hold up a lot better than the last ones I bought (we'll call those brand-X). I've had these for just over a year now and they are still working great. I've seen a few complaints about them streaking or not clearing as well after a few months. I honestly saw this too, but with a simple wipe-down of the blades (the actual black rubber part) while cleaning my windshield they are working about as good as they did new. I will definitely be buying these again and will be recommending them to friends and family.",Yes,,Not Deleted,,,R25W12M65YEC5J
,,B005JU5V6E,US,"Bosch ICON 21A Wiper Blade, Up to 40% Longer Life* - 21"" (Pack of 1)",https://www.amazon.com/gp/customer-reviews/R18S3HQTGAVFT5,4.0,2018-05-22,https://www.amazon.com/gp/profile/amzn1.account.AGRVHDNWZDRDONSUBG7HDLRNWELA/ref=cm_cr_arp_d_gw_btm?ie=UTF8,R. Bales,AGRVHDNWZDRDONSUBG7HDLRNWELA,Four Stars,Great wipers. I will revise to 5 stars if they last at least a year.,Yes,,Not Deleted,,,R18S3HQTGAVFT5
,,B005JU5V6E,US,"Bosch ICON 21A Wiper Blade, Up to 40% Longer Life* - 21"" (Pack of 1)",https://www.amazon.com/gp/customer-reviews/RDFE4KXVK44VF,5.0,2018-05-22,https://www.amazon.com/gp/profile/amzn1.account.AGTDS6T7XQGPS5HVLW5A5HRD4VLA/ref=cm_cr_arp_d_gw_btm?ie=UTF8,Clifford,AGTDS6T7XQGPS5HVLW5A5HRD4VLA,Five Stars,A real stand up blade in all weather,Yes,,Not Deleted,,,RDFE4KXVK44VF
,,B005JU5V6E,US,"Bosch ICON 21A Wiper Blade, Up to 40% Longer Life* - 21"" (Pack of 1)",https://www.amazon.com/gp/customer-reviews/R1Q3HS416G9715,3.0,2018-05-21,https://www.amazon.com/gp/profile/amzn1.account.AHK2COYJYEPZ7I473R2I2IRL42JQ/ref=cm_cr_arp_d_gw_btm?ie=UTF8,Jason,AHK2COYJYEPZ7I473R2I2IRL42JQ,It hasn't lasted,It worked alright for about 3 months and now I'm right back where I was with terrible performance. I already cleaned them and they're not doing great.,Yes,,Not Deleted,,,R1Q3HS416G9715
,,B005JU5V6E,US,"Bosch ICON 21A Wiper Blade, Up to 40% Longer Life* - 21"" (Pack of 1)",https://www.amazon.com/gp/customer-reviews/R2F1ESHUR9XZ0G,5.0,2018-05-18,https://www.amazon.com/gp/profile/amzn1.account.AE4OCPMXJTEAYHQ3IEUNFR4T5JXA/ref=cm_cr_arp_d_gw_btm?ie=UTF8,Amazon Customer,AE4OCPMXJTEAYHQ3IEUNFR4T5JXA,best wiper I've used,best wiper I have used in recent memory -very quiet  very good build qualitity,Yes,,Not Deleted,,,R2F1ESHUR9XZ0G
,,B005JU5V6E,US,"Bosch ICON 21A Wiper Blade, Up to 40% Longer Life* - 21"" (Pack of 1)",https://www.amazon.com/gp/customer-reviews/R2C4PJ8KK6Z1CP,5.0,2018-05-13,https://www.amazon.com/gp/profile/amzn1.account.AF54U5RBJVGSSPKFCMDQ5V6EHECQ/ref=cm_cr_arp_d_gw_btm?ie=UTF8,Amazon Customer,AF54U5RBJVGSSPKFCMDQ5V6EHECQ,"Holding up well, excellent job","Didn't realize how bad my old windshield wipers were until I installed these. Huge difference. Easy to install, and they do a great job",Yes,,Not Deleted,,,R2C4PJ8KK6Z1CP
,,B005JU5V6E,US,"Bosch ICON 21A Wiper Blade, Up to 40% Longer Life* - 21"" (Pack of 1)",https://www.amazon.com/gp/customer-reviews/R17PJ99SA48T4O,5.0,2018-05-12,https://www.amazon.com/gp/profile/amzn1.account.AFV3U65CYMFGQF3C2FQTFKR23KMQ/ref=cm_cr_arp_d_gw_btm?ie=UTF8,Bucky,AFV3U65CYMFGQF3C2FQTFKR23KMQ,Five Stars,Item arrived broken but still seems to work fine.,Yes,,Not Deleted,,,R17PJ99SA48T4O
,,B005JU5V6E,US,"Bosch ICON 21A Wiper Blade, Up to 40% Longer Life* - 21"" (Pack of 1)",https://www.amazon.com/gp/customer-reviews/R37J692256YKWA,4.0,2018-05-11,https://www.amazon.com/gp/profile/amzn1.account.AETDKDBCYWQAWGHRZJ3Z2I6G36KA/ref=cm_cr_arp_d_gw_btm?ie=UTF8,Aaron Reese,AETDKDBCYWQAWGHRZJ3Z2I6G36KA,Four Stars,Wipers are good but haven't had them long and squeaking already.  Cheaper than stores though,Yes,,Not Deleted,,,R37J692256YKWA
,,B005JU5V6E,US,"Bosch ICON 21A Wiper Blade, Up to 40% Longer Life* - 21"" (Pack of 1)",https://www.amazon.com/gp/customer-reviews/R39DKAC4MNZ36L,5.0,2018-05-10,https://www.amazon.com/gp/profile/amzn1.account.AF5SGIPVLUGNJZPBVSEDI723MHMA/ref=cm_cr_arp_d_gw_btm?ie=UTF8,Blaine,AF5SGIPVLUGNJZPBVSEDI723MHMA,Can always get a good price on these on Amazon,"I have used these on both vehicles for the past several years, would not buy anything else.  Can always get a good price on these on Amazon. I replace yearly, they hold up through 100-degree summers and snowy sub-zero winters.",Yes,,Not Deleted,,,R39DKAC4MNZ36L
,,B005JU5V6E,US,"Bosch ICON 21A Wiper Blade, Up to 40% Longer Life* - 21"" (Pack of 1)",https://www.amazon.com/gp/customer-reviews/R14YMSVXACYGIV,5.0,2018-05-08,https://www.amazon.com/gp/profile/amzn1.account.AFKVVJ7ENQEV7JH423NJZRL6CPXQ/ref=cm_cr_arp_d_gw_btm?ie=UTF8,Michael,AFKVVJ7ENQEV7JH423NJZRL6CPXQ,Five Stars,Impressed so far.,Yes,,Not Deleted,,,R14YMSVXACYGIV
,,B005JU5V6E,US,"Bosch ICON 21A Wiper Blade, Up to 40% Longer Life* - 21"" (Pack of 1)",https://www.amazon.com/gp/customer-reviews/R1946KOB4CDRAJ,2.0,2018-05-06,https://www.amazon.com/gp/profile/amzn1.account.AEMHH3XJ7O6PZ7XZZL2EDLCH6Z4Q/ref=cm_cr_arp_d_gw_btm?ie=UTF8,Thomasj106,AEMHH3XJ7O6PZ7XZZL2EDLCH6Z4Q,Not great. Rain-X does a better job for less money,Not great.  Rain-X does a better job for less money.  These will were out fast then I'll go back to the better brand.,Yes,,Not Deleted,,,R1946KOB4CDRAJ
,,B005JU5V6E,US,"Bosch ICON 21A Wiper Blade, Up to 40% Longer Life* - 21"" (Pack of 1)",https://www.amazon.com/gp/customer-reviews/RALAHM38BF02H,1.0,2018-04-24,https://www.amazon.com/gp/profile/amzn1.account.AFZISDY247Y2DWAP7DMI5YF63IIA/ref=cm_cr_arp_d_gw_btm?ie=UTF8,Mouser,AFZISDY247Y2DWAP7DMI5YF63IIA,Bosch ICON blades not compatible w/ 19mm Top Lock wiper arms.  Period.,"Bosch ICON blades, despite the advertisement above that they are compatible with (""cover"") all wiper arm types - do *not* fit 19mm ""Top Lock"" wiper arms.  They are incompatible.  Not even close to fitting.",No,,Not Deleted,,,RALAHM38BF02H
,,B005JU5V6E,US,"Bosch ICON 21A Wiper Blade, Up to 40% Longer Life* - 21"" (Pack of 1)",https://www.amazon.com/gp/customer-reviews/R18BH1LIJSINQL,5.0,2018-04-21,https://www.amazon.com/gp/profile/amzn1.account.AFXIOQDJAVKAOPL6HMP4SQON5FVA/ref=cm_cr_arp_d_gw_btm?ie=UTF8,Charles Williams,AFXIOQDJAVKAOPL6HMP4SQON5FVA,WOW! No streaks!,Best wiper I've found yet.  Excellent product.,Yes,,Not Deleted,,,R18BH1LIJSINQL
,,B005JU5V6E,US,"Bosch ICON 21A Wiper Blade, Up to 40% Longer Life* - 21"" (Pack of 1)",https://www.amazon.com/gp/customer-reviews/R3G382M1TZ75JL,5.0,2018-04-17,https://www.amazon.com/gp/profile/amzn1.account.AGTQMC675U6IGV3P77EAS37CFADQ/ref=cm_cr_arp_d_gw_btm?ie=UTF8,N. Wetherbee,AGTQMC675U6IGV3P77EAS37CFADQ,I've tried a couple other style replacement blades but these are the best. They also happen to be the exact OEM ...,I use these on a 2007 VW Passat. I've tried a couple other style replacement blades but these are the best. They also happen to be the exact OEM blades that came on the car so I guess they knew what they were doing.,Yes,,Not Deleted,,,R3G382M1TZ75JL
,,B005JU5V6E,US,"Bosch ICON 21A Wiper Blade, Up to 40% Longer Life* - 21"" (Pack of 1)",https://www.amazon.com/gp/customer-reviews/R2R92ZNU5CRCDD,5.0,2018-04-10,https://www.amazon.com/gp/profile/amzn1.account.AF6XEWH6ULRODHXBCEYUNAM5SMEQ/ref=cm_cr_arp_d_gw_btm?ie=UTF8,Will Alleguez,AF6XEWH6ULRODHXBCEYUNAM5SMEQ,Best wipers I have ever had,Best wipers I have ever had. I’ve had the same set on my car for the past 2 years. I live in the Midwest and have cold and snowy winters which normally destroys wiper blades but not these,Yes,,Not Deleted,,,R2R92ZNU5CRCDD
,,B005JU5V6E,US,"Bosch ICON 21A Wiper Blade, Up to 40% Longer Life* - 21"" (Pack of 1)",https://www.amazon.com/gp/customer-reviews/R25SUWWOEK1MP1,5.0,2018-04-09,https://www.amazon.com/gp/profile/amzn1.account.AGKZ7UMIA3RQ4HTBYFLYEGSPWDVA/ref=cm_cr_arp_d_gw_btm?ie=UTF8,Paul Petrilli,AGKZ7UMIA3RQ4HTBYFLYEGSPWDVA,GOOD TO KNOW WHERE I CAN PROCURE PRODUCT AT A VERY REASONABLE,PERFECT FOR MY JEEP G. CHEROKEE,Yes,,Not Deleted,,,R25SUWWOEK1MP1
,,B005JU5V6E,US,"Bosch ICON 21A Wiper Blade, Up to 40% Longer Life* - 21"" (Pack of 1)",https://www.amazon.com/gp/customer-reviews/R4X9ISMRC6X1Q,5.0,2018-04-03,https://www.amazon.com/gp/profile/amzn1.account.AFEUTJSCB2EL65V6DGD3XKJA2UQQ/ref=cm_cr_arp_d_gw_btm?ie=UTF8,Sal,AFEUTJSCB2EL65V6DGD3XKJA2UQQ,Great quality wiper blade,"This wiper blade fit my Honda-CRV 2003 perfectly, no streaks, no noise. It seems high quality, now it must stand the test of time. The real review comes a year or two from now.",Yes,,Not Deleted,,,R4X9ISMRC6X1Q
,,B005JU5V6E,US,"Bosch ICON 21A Wiper Blade, Up to 40% Longer Life* - 21"" (Pack of 1)",https://www.amazon.com/gp/customer-reviews/R311GOH73O120S,5.0,2018-04-02,https://www.amazon.com/gp/profile/amzn1.account.AGRNVJKYUA4ER5USEJGKIXPRURFA/ref=cm_cr_arp_d_gw_btm?ie=UTF8,Michael Heironimus,AGRNVJKYUA4ER5USEJGKIXPRURFA,Good replacement,"Feels like a quality wiper blade, proper fit, easy install on my Grand Cherokee.",Yes,,Not Deleted,,,R311GOH73O120S
,,B005JU5V6E,US,"Bosch ICON 21A Wiper Blade, Up to 40% Longer Life* - 21"" (Pack of 1)",https://www.amazon.com/gp/customer-reviews/R10KZMPGOQHKQO,2.0,2018-04-02,https://www.amazon.com/gp/profile/amzn1.account.AFCJEWILQKCSFL65CHNYFOCT523A/ref=cm_cr_arp_d_gw_btm?ie=UTF8,Dave S.,AFCJEWILQKCSFL65CHNYFOCT523A,Doesn't completely clear the glass,"With such a great name brand behind them, I thought they would be terrific. The driver side blade does not lay flat on the glass and leaves big wide swaths of glass not wiped.  I returned the wiper once, but the second wiper did the same thing. I guess I will be buying a different brand in the future.",Yes,,Not Deleted,,,R10KZMPGOQHKQO
,,B005JU5V6E,US,"Bosch ICON 21A Wiper Blade, Up to 40% Longer Life* - 21"" (Pack of 1)",https://www.amazon.com/gp/customer-reviews/RIBYSNE7KRLQD,5.0,2018-03-26,https://www.amazon.com/gp/profile/amzn1.account.AFR32J4PDSVYTHO6H6YSISCXXVLQ/ref=cm_cr_arp_d_gw_btm?ie=UTF8,Matt G.,AFR32J4PDSVYTHO6H6YSISCXXVLQ,Five Stars,Great wipers.,Yes,,Not Deleted,,,RIBYSNE7KRLQD
,,B005JU5V6E,US,"Bosch ICON 21A Wiper Blade, Up to 40% Longer Life* - 21"" (Pack of 1)",https://www.amazon.com/gp/customer-reviews/RWHO5XL2TCU4B,5.0,2018-03-22,https://www.amazon.com/gp/profile/amzn1.account.AGB4K4RZKXKCWZYFCDY6XTIBKEEQ/ref=cm_cr_arp_d_gw_btm?ie=UTF8,MNSawdust,AGB4K4RZKXKCWZYFCDY6XTIBKEEQ,Five Stars,best wipers,Yes,,Not Deleted,,,RWHO5XL2TCU4B
,,B005JU5V6E,US,"Bosch ICON 21A Wiper Blade, Up to 40% Longer Life* - 21"" (Pack of 1)",https://www.amazon.com/gp/customer-reviews/R28M4KC7IM0DNJ,3.0,2018-03-22,https://www.amazon.com/gp/profile/amzn1.account.AHKVDCCEFKFH2AUXECJXI3BJO7OQ/ref=cm_cr_arp_d_gw_btm?ie=UTF8,Amazon Customer,AHKVDCCEFKFH2AUXECJXI3BJO7OQ,No good. Installed on my 2016 Dodge Charger,No good. Installed on my 2016 Dodge Charger. Easy install but leaves streaks on my window right out of the box. Will not buy again.,Yes,,Not Deleted,,,R28M4KC7IM0DNJ
,,B005JU5V6E,US,"Bosch ICON 21A Wiper Blade, Up to 40% Longer Life* - 21"" (Pack of 1)",https://www.amazon.com/gp/customer-reviews/R2FO0NVEEXWL8C,5.0,2018-03-19,https://www.amazon.com/gp/profile/amzn1.account.AHHWUAX55MCZEHNK3KILSFQYXB6A/ref=cm_cr_arp_d_gw_btm?ie=UTF8,Amanda,AHHWUAX55MCZEHNK3KILSFQYXB6A,They work great!,Not much to say.  They work great!,Yes,,Not Deleted,,,R2FO0NVEEXWL8C
,,B005JU5V6E,US,"Bosch ICON 21A Wiper Blade, Up to 40% Longer Life* - 21"" (Pack of 1)",https://www.amazon.com/gp/customer-reviews/R3KMJLG6VSQSK8,5.0,2018-03-17,https://www.amazon.com/gp/profile/amzn1.account.AHF7IGJGCQNQALKJWY4AOVUQVUPA/ref=cm_cr_arp_d_gw_btm?ie=UTF8,Dave,AHF7IGJGCQNQALKJWY4AOVUQVUPA,Excellent wiper blade,Excellent wiper blade.  A bit loud if there is minimal fluid.  My last blade cracked my windshield after ice pealed the rubber off the metal.  No metal  here and it works better.  Happy with this purchase.,Yes,,Not Deleted,,,R3KMJLG6VSQSK8
,,B005JU5V6E,US,"Bosch ICON 21A Wiper Blade, Up to 40% Longer Life* - 21"" (Pack of 1)",https://www.amazon.com/gp/customer-reviews/R1CV0O406211W3,5.0,2018-03-12,https://www.amazon.com/gp/profile/amzn1.account.AFJ4XXC6F67FL7NVF7G2ZNUHMW6A/ref=cm_cr_arp_d_gw_btm?ie=UTF8,Amazon Customer,AFJ4XXC6F67FL7NVF7G2ZNUHMW6A,Five Stars,Great quality for 10.00 less than any auto store on average.,Yes,,Not Deleted,,,R1CV0O406211W3
,,B005JU5V6E,US,"Bosch ICON 21A Wiper Blade, Up to 40% Longer Life* - 21"" (Pack of 1)",https://www.amazon.com/gp/customer-reviews/R3QAYYTSMRF8M7,5.0,2018-03-12,https://www.amazon.com/gp/profile/amzn1.account.AF63GESWIZCV7MRVWHMXBPWYZIFA/ref=cm_cr_arp_d_gw_btm?ie=UTF8,Corry E. Sheely,AF63GESWIZCV7MRVWHMXBPWYZIFA,Five Stars,So far so good wipers work like a champ on my Charger.,Yes,,Not Deleted,,,R3QAYYTSMRF8M7
,,B005JU5V6E,US,"Bosch ICON 21A Wiper Blade, Up to 40% Longer Life* - 21"" (Pack of 1)",https://www.amazon.com/gp/customer-reviews/RXT3XRO5OMD9C,3.0,2018-03-05,https://www.amazon.com/gp/profile/amzn1.account.AE2SA4SLP52O25SY64RUJSMEWJGQ/ref=cm_cr_arp_d_gw_btm?ie=UTF8,David,AE2SA4SLP52O25SY64RUJSMEWJGQ,Three Stars,"""Skips"" on my Tacoma.",Yes,,Not Deleted,,,RXT3XRO5OMD9C
,,B005JU5V6E,US,"Bosch ICON 21A Wiper Blade, Up to 40% Longer Life* - 21"" (Pack of 1)",https://www.amazon.com/gp/customer-reviews/RL95NFBMD0UI9,5.0,2018-03-02,https://www.amazon.com/gp/profile/amzn1.account.AEI6VDXBDNFUG3CQB7S7C573UHQA/ref=cm_cr_arp_d_gw_btm?ie=UTF8,Josh Cao,AEI6VDXBDNFUG3CQB7S7C573UHQA,great quality. thank,"very fast shipping, great quality. thank you",Yes,,Not Deleted,,,RL95NFBMD0UI9
,,B005JU5V6E,US,"Bosch ICON 21A Wiper Blade, Up to 40% Longer Life* - 21"" (Pack of 1)",https://www.amazon.com/gp/customer-reviews/R26SJ1Y1WP9RT6,5.0,2018-02-22,https://www.amazon.com/gp/profile/amzn1.account.AHT4IFLETAU6GLTQIWJ5MKT3K6IQ/ref=cm_cr_arp_d_gw_btm?ie=UTF8,JS,AHT4IFLETAU6GLTQIWJ5MKT3K6IQ,Five Stars,works as expected,Yes,,Not Deleted,,,R26SJ1Y1WP9RT6
,,B005JU5V6E,US,"Bosch ICON 21A Wiper Blade, Up to 40% Longer Life* - 21"" (Pack of 1)",https://www.amazon.com/gp/customer-reviews/R2ZJ5O3YTPTNB3,5.0,2018-02-21,https://www.amazon.com/gp/profile/amzn1.account.AENGFN2VAQUXLMOHJFIM7XMR7LHQ/ref=cm_cr_arp_d_gw_btm?ie=UTF8,Jason N.,AENGFN2VAQUXLMOHJFIM7XMR7LHQ,love icon blades!,great blades!,Yes,,Not Deleted,,,R2ZJ5O3YTPTNB3
,,B005JU5V6E,US,"Bosch ICON 21A Wiper Blade, Up to 40% Longer Life* - 21"" (Pack of 1)",https://www.amazon.com/gp/customer-reviews/RV7TMAW6Q8O5T,1.0,2018-02-21,https://www.amazon.com/gp/profile/amzn1.account.AHUGGUZFMXW3OG6EWA73VDBJSWBQ/ref=cm_cr_arp_d_gw_btm?ie=UTF8,HARRY HODGE,AHUGGUZFMXW3OG6EWA73VDBJSWBQ,Wrong blade,Received a old used wiper blade,Yes,,Not Deleted,,,RV7TMAW6Q8O5T
,,B005JU5V6E,US,"Bosch ICON 21A Wiper Blade, Up to 40% Longer Life* - 21"" (Pack of 1)",https://www.amazon.com/gp/customer-reviews/R34MLTHAEE4P0U,5.0,2018-02-20,https://www.amazon.com/gp/profile/amzn1.account.AGKQA2TK5LXH3G22P2HXXRWISMTQ/ref=cm_cr_arp_d_gw_btm?ie=UTF8,Patrick McHugh,AGKQA2TK5LXH3G22P2HXXRWISMTQ,Great product.,Just what my 2005 Jeep Grand Cherokee needed.,Yes,,Not Deleted,,,R34MLTHAEE4P0U
,,B005JU5V6E,US,"Bosch ICON 21A Wiper Blade, Up to 40% Longer Life* - 21"" (Pack of 1)",https://www.amazon.com/gp/customer-reviews/R2WO349MLGSRNS,5.0,2018-02-10,https://www.amazon.com/gp/profile/amzn1.account.AFDKJXIZ7LI6B2IROGHDWCUEVBPQ/ref=cm_cr_arp_d_gw_btm?ie=UTF8,Infosquirrel,AFDKJXIZ7LI6B2IROGHDWCUEVBPQ,Five Stars,Great price. Exactly as pictured. Fast & secure shipping.,Yes,,Not Deleted,,,R2WO349MLGSRNS
,,B005JU5V6E,US,"Bosch ICON 21A Wiper Blade, Up to 40% Longer Life* - 21"" (Pack of 1)",https://www.amazon.com/gp/customer-reviews/R6RTUCRAIGGIZ,5.0,2018-02-03,https://www.amazon.com/gp/profile/amzn1.account.AGM5ZDBNXELF4MIMCSFRXHU33RLQ/ref=cm_cr_arp_d_gw_btm?ie=UTF8,Amazon Customer,AGM5ZDBNXELF4MIMCSFRXHU33RLQ,Five Stars,Best wipers on the market!!,Yes,,Not Deleted,,,R6RTUCRAIGGIZ
,,B005JU5V6E,US,"Bosch ICON 21A Wiper Blade, Up to 40% Longer Life* - 21"" (Pack of 1)",https://www.amazon.com/gp/customer-reviews/R2YT6109MDDU4G,4.0,2018-01-31,https://www.amazon.com/gp/profile/amzn1.account.AF7LAWFMIYRX7O2LA5LL4HI7A7CQ/ref=cm_cr_arp_d_gw_btm?ie=UTF8,Your Average Joe,AF7LAWFMIYRX7O2LA5LL4HI7A7CQ,Great Blades,"I installed these on my vehicle as well as my wife's, and after a year of use I will say, these are GREAT wipers! They work well in three of the four seasons here, hugging the windshield and giving an even wipe over the distance of the windshield. The only reason I give them four stars, is their performance in the winter is not as good as some of the blades I've used in the past. Perhaps this is due to their low profile (bar style). Installation was VERY easy- probably the easiest I've ever had.",Yes,,Not Deleted,,,R2YT6109MDDU4G
,,B005JU5V6E,US,"Bosch ICON 21A Wiper Blade, Up to 40% Longer Life* - 21"" (Pack of 1)",https://www.amazon.com/gp/customer-reviews/R1ZP8642ZB6HPH,5.0,2018-01-31,https://www.amazon.com/gp/profile/amzn1.account.AET3UEAELQYO6MZWDONWWPEOYBTQ/ref=cm_cr_arp_d_gw_btm?ie=UTF8,Flyboyyy,AET3UEAELQYO6MZWDONWWPEOYBTQ,"Minnesota tested and works well in heavy snow/ice, etc..","First off, I do give windshield wipers a good workout living in the frozen tundra of Minnesota, so we get a chance to really use these things hard! For whatever reason, I end up with a different vehicle almost yearly, and almost without fail the factory supplied stock wipers are always junk (or a step below).  Heavy slush, snow, ice, etc.. for many months on end means we need a good wiper blades and these are among the best.  Not much else to say, they work great, easy to install and seem to last fairly well.",Yes,,Not Deleted,,,R1ZP8642ZB6HPH
,,B005JU5V6E,US,"Bosch ICON 21A Wiper Blade, Up to 40% Longer Life* - 21"" (Pack of 1)",https://www.amazon.com/gp/customer-reviews/R33PZSU78GOXSW,4.0,2018-01-17,https://www.amazon.com/gp/profile/amzn1.account.AENPNMVURV7YCP7Y562Z5E77IB4Q/ref=cm_cr_arp_d_gw_btm?ie=UTF8,Tim L.,AENPNMVURV7YCP7Y562Z5E77IB4Q,Four Stars,Good blades but kinda pricey,Yes,,Not Deleted,,,R33PZSU78GOXSW
,,B005JU5V6E,US,"Bosch ICON 21A Wiper Blade, Up to 40% Longer Life* - 21"" (Pack of 1)",https://www.amazon.com/gp/customer-reviews/R2QXZQS0J3UUE8,5.0,2018-01-15,https://www.amazon.com/gp/profile/amzn1.account.AFJREFFDPJPMUTWFTPBCLIWCCLJQ/ref=cm_cr_arp_d_gw_btm?ie=UTF8,Mohsin Imran,AFJREFFDPJPMUTWFTPBCLIWCCLJQ,Five Stars,great wipers and easy to install,Yes,,Not Deleted,,,R2QXZQS0J3UUE8
,,B005JU5V6E,US,"Bosch ICON 21A Wiper Blade, Up to 40% Longer Life* - 21"" (Pack of 1)",https://www.amazon.com/gp/customer-reviews/R3DVJYNNXH52NC,5.0,2018-01-14,https://www.amazon.com/gp/profile/amzn1.account.AHDCR2QXCDER5EF4ZLKCKKMDAJHQ/ref=cm_cr_arp_d_gw_btm?ie=UTF8,CalGuY,AHDCR2QXCDER5EF4ZLKCKKMDAJHQ,Audi TT Wiper Blades,Perfect fit as stated,Yes,,Not Deleted,,,R3DVJYNNXH52NC
,,B005JU5V6E,US,"Bosch ICON 21A Wiper Blade, Up to 40% Longer Life* - 21"" (Pack of 1)",https://www.amazon.com/gp/customer-reviews/RGNMKUTA87UF8,5.0,2018-01-14,https://www.amazon.com/gp/profile/amzn1.account.AGLCC2CTGDVOUTGQVFHDXIM62GFA/ref=cm_cr_arp_d_gw_btm?ie=UTF8,pfictionfan4life,AGLCC2CTGDVOUTGQVFHDXIM62GFA,Five Stars,new wipers are such a gratifying thing. smooth as silk and a clean view. A+,Yes,,Not Deleted,,,RGNMKUTA87UF8
,,B005JU5V6E,US,"Bosch ICON 21A Wiper Blade, Up to 40% Longer Life* - 21"" (Pack of 1)",https://www.amazon.com/gp/customer-reviews/RUUMCK4KPPULO,5.0,2018-01-12,https://www.amazon.com/gp/profile/amzn1.account.AFMTKSUD6RURQSOJDBEASBI2K3XQ/ref=cm_cr_arp_d_gw_btm?ie=UTF8,Ron W,AFMTKSUD6RURQSOJDBEASBI2K3XQ,Five Stars,"Excellent, it performs real well. One swipe and my windshield is clean, no streaks at all.",Yes,,Not Deleted,,,RUUMCK4KPPULO
,,B005JU5V6E,US,"Bosch ICON 21A Wiper Blade, Up to 40% Longer Life* - 21"" (Pack of 1)",https://www.amazon.com/gp/customer-reviews/R1GZZ1V0IJLWGK,5.0,2018-01-11,https://www.amazon.com/gp/profile/amzn1.account.AEGAJFB6FQEDM6GFXM6RPPCS2DPA/ref=cm_cr_arp_d_gw_btm?ie=UTF8,ben,AEGAJFB6FQEDM6GFXM6RPPCS2DPA,Five Stars,"Easy to install
Performs well",Yes,,Not Deleted,,,R1GZZ1V0IJLWGK
