category,product_custom_name,asin,country_code,product_title,review_url,review_rating,review_date,reviewer_url,reviewer_name,reviewer_id,review_title,review_text,review_verified,variation_asin,deleted,deleted_datetime,product_attributes,amazon_review_id
,,B005JU5V6E,US,"Bosch ICON 21A Wiper Blade, Up to 40% Longer Life* - 21"" (Pack of 1)",https://www.amazon.com/gp/customer-reviews/R2ZI6BZA7YNJHH,1.0,2016-11-23,https://www.amazon.com/gp/profile/amzn1.account.AHH7ZFZOWIKXRLT5ILWDTYGPFCMA/ref=cm_cr_arp_d_gw_btm?ie=UTF8,Andy,AHH7ZFZOWIKXRLT5ILWDTYGPFCMA,It didn't fit my car despite amazon saying it does ...,"It didn't fit my car despite amazon saying it does. Dear Bosch, please correct your fitting guide for VW Passats.",No,,Not Deleted,,,R2ZI6BZA7YNJHH
,,B005JU5V6E,US,"Bosch ICON 21A Wiper Blade, Up to 40% Longer Life* - 21"" (Pack of 1)",https://www.amazon.com/gp/customer-reviews/R3B09J0DXOQ1G1,5.0,2016-11-19,https://www.amazon.com/gp/profile/amzn1.account.AFQM6654SC6PYEB4KOJ6KKEYQWEA/ref=cm_cr_arp_d_gw_btm?ie=UTF8,Alex,AFQM6654SC6PYEB4KOJ6KKEYQWEA,Five Stars,Easy to install they work great,Yes,,Not Deleted,,,R3B09J0DXOQ1G1
,,B005JU5V6E,US,"Bosch ICON 21A Wiper Blade, Up to 40% Longer Life* - 21"" (Pack of 1)",https://www.amazon.com/gp/customer-reviews/RBLY1BNXYZ75O,5.0,2016-11-16,https://www.amazon.com/gp/profile/amzn1.account.AHUUUAKV47AHEFR3VWGQVOALLNVQ/ref=cm_cr_arp_d_gw_btm?ie=UTF8,MadiDaisy,AHUUUAKV47AHEFR3VWGQVOALLNVQ,Five Stars,"Awesome, works well.",Yes,,Not Deleted,,,RBLY1BNXYZ75O
,,B005JU5V6E,US,"Bosch ICON 21A Wiper Blade, Up to 40% Longer Life* - 21"" (Pack of 1)",https://www.amazon.com/gp/customer-reviews/R2PMSA8059ALBV,3.0,2016-11-15,https://www.amazon.com/gp/profile/amzn1.account.AHHL5MBCHRSA7JA7XO6UMNRTDH7Q/ref=cm_cr_arp_d_gw_btm?ie=UTF8,Marthaman,AHHL5MBCHRSA7JA7XO6UMNRTDH7Q,Proper model number does not guarantee excellent performance.,"This is a review of the results on two different vehicles with this wiper blade.  These blades (proper model number) fit and performed excellently on my Lexus RX350, 2007.  However, despite buying the proper model (as checked by phone with Bosch), they did not perform well on my Infiniti G20, 1999.  In one direction, they cleaned the windshield; in the other, they left a curve of water.  I checked this out with my car repair guy.  He agrees that, although Bosch wiper blades generally give excellent performance, some models do not have adequate give/flexibility on some windshields.  He put on another Bosch model, not as highly rated, that did the trick.  So, before buying advise carefully picking through the reviews to confirm that, beyond a specific model for your car, that it actually provides a good performance when placed on the car.",Yes,,Not Deleted,,,R2PMSA8059ALBV
,,B005JU5V6E,US,"Bosch ICON 21A Wiper Blade, Up to 40% Longer Life* - 21"" (Pack of 1)",https://www.amazon.com/gp/customer-reviews/R39QE5XOM5W9K2,5.0,2016-11-14,https://www.amazon.com/gp/profile/amzn1.account.AHRUTBOJNTZB2KBPDOEP35FYQTAQ/ref=cm_cr_arp_d_gw_btm?ie=UTF8,Drew Hayes,AHRUTBOJNTZB2KBPDOEP35FYQTAQ,the best wiper blades out there,"Purchased for my 2005 Mitsubishi Endeavor. Bosch makes, hands down, the best wiper blades out there. They truly work wonders. No streaks, leave your windshield spotless after each wipe and have a good lifespan. You will not be disappointed.",Yes,,Not Deleted,,,R39QE5XOM5W9K2
,,B005JU5V6E,US,"Bosch ICON 21A Wiper Blade, Up to 40% Longer Life* - 21"" (Pack of 1)",https://www.amazon.com/gp/customer-reviews/RAHC0QN9YTA1L,5.0,2016-11-13,https://www.amazon.com/gp/profile/amzn1.account.AEHBNU5AY76FUV2PM4IABR2RCF6Q/ref=cm_cr_arp_d_gw_btm?ie=UTF8,Patrick B.,AEHBNU5AY76FUV2PM4IABR2RCF6Q,Five Stars,Great wipers and super easy install on my Porsche.,Yes,,Not Deleted,,,RAHC0QN9YTA1L
,,B005JU5V6E,US,"Bosch ICON 21A Wiper Blade, Up to 40% Longer Life* - 21"" (Pack of 1)",https://www.amazon.com/gp/customer-reviews/R2ICGBXFLUXIIK,5.0,2016-11-11,https://www.amazon.com/gp/profile/amzn1.account.AHXEBQEAZIJRSYSBZNJLP7WWIZIQ/ref=cm_cr_arp_d_gw_btm?ie=UTF8,Amazon Customer,AHXEBQEAZIJRSYSBZNJLP7WWIZIQ,Five Stars,Perfect fit!,Yes,,Not Deleted,,,R2ICGBXFLUXIIK
,,B005JU5V6E,US,"Bosch ICON 21A Wiper Blade, Up to 40% Longer Life* - 21"" (Pack of 1)",https://www.amazon.com/gp/customer-reviews/R2VH3BQHMNZGQO,5.0,2016-11-10,https://www.amazon.com/gp/profile/amzn1.account.AEXYUUEKNBZPFKDMQSPRR2RSVKLA/ref=cm_cr_arp_d_gw_btm?ie=UTF8,stateofaloha59,AEXYUUEKNBZPFKDMQSPRR2RSVKLA,Love this replacement blade!,Make sure you match you car to the description on the product page. After that installation will be quick easy! Very well made!,Yes,,Not Deleted,,,R2VH3BQHMNZGQO
,,B005JU5V6E,US,"Bosch ICON 21A Wiper Blade, Up to 40% Longer Life* - 21"" (Pack of 1)",https://www.amazon.com/gp/customer-reviews/R26FUANNNB2779,4.0,2016-11-03,https://www.amazon.com/gp/profile/amzn1.account.AEZT23ZZCGPY3CW4IKAAZSX5UBUQ/ref=cm_cr_arp_d_gw_btm?ie=UTF8,Minerhaas1,AEZT23ZZCGPY3CW4IKAAZSX5UBUQ,Performed well.,Has performed well but only had them on my car for a short time.,Yes,,Not Deleted,,,R26FUANNNB2779
,,B005JU5V6E,US,"Bosch ICON 21A Wiper Blade, Up to 40% Longer Life* - 21"" (Pack of 1)",https://www.amazon.com/gp/customer-reviews/R3D5EMFIZ5IMNB,5.0,2016-10-26,https://www.amazon.com/gp/profile/amzn1.account.AFK3GP5T3IULLXDVF7QAFFF3E75A/ref=cm_cr_arp_d_gw_btm?ie=UTF8,DAVID M SHOUP,AFK3GP5T3IULLXDVF7QAFFF3E75A,The best wiper blades money can buy,Outstanding! The best wiper blades money can buy!,Yes,,Not Deleted,,,R3D5EMFIZ5IMNB
,,B005JU5V6E,US,"Bosch ICON 21A Wiper Blade, Up to 40% Longer Life* - 21"" (Pack of 1)",https://www.amazon.com/gp/customer-reviews/R1491SVA7TKQ4V,5.0,2016-10-23,https://www.amazon.com/gp/profile/amzn1.account.AES72CXUH4YOS52D7S2BMVSKRNNA/ref=cm_cr_arp_d_gw_btm?ie=UTF8,ALF Engineer,AES72CXUH4YOS52D7S2BMVSKRNNA,Good choice but no real advantage,Fit as advertised. Easy assembly. No streaks..  pretty much like every other wiper in this price range,No,,Not Deleted,,,R1491SVA7TKQ4V
,,B005JU5V6E,US,"Bosch ICON 21A Wiper Blade, Up to 40% Longer Life* - 21"" (Pack of 1)",https://www.amazon.com/gp/customer-reviews/R3N2HMV8OU0JU8,5.0,2016-10-09,https://www.amazon.com/gp/profile/amzn1.account.AFOZB6GP7LV43RT7T636TVTJSDTQ/ref=cm_cr_arp_d_gw_btm?ie=UTF8,Chris Menard,AFOZB6GP7LV43RT7T636TVTJSDTQ,I can see,These Wiper blades wisk the water away. I can now see the car in front of me.  My insurance company is much happier now.,Yes,,Not Deleted,,,R3N2HMV8OU0JU8
,,B005JU5V6E,US,"Bosch ICON 21A Wiper Blade, Up to 40% Longer Life* - 21"" (Pack of 1)",https://www.amazon.com/gp/customer-reviews/R2DO51B5JJUREO,1.0,2016-10-09,https://www.amazon.com/gp/profile/amzn1.account.AH2N34PTA3NYC7HGHB5ETRFTJ4TQ/ref=cm_cr_arp_d_gw_btm?ie=UTF8,Straight answers!,AH2N34PTA3NYC7HGHB5ETRFTJ4TQ,First time user for Bosch blade.,"Excellent wipers, very easy install, 20 seconds each side. Took longer to get out of package then to put on. First time using Bosch blades, always used Anco 600 which work great, but didn't see for the 15 Durango at the time. Had for only three weeks on, and used heavy for week now in WA rain, and they work very well. Tried the latitude blades twice, and not happy. You won't go wrong with these blades. Will update after a few months of use. UPDATE 11/26/16. Well, I would give 0 stars now. Used a total of three weeks in WA rain then working in CA till two weeks ago where I didn't have to use at all. They are very streaky with multiple lines on the windshield. I cleaned the windshield and the wiper blades thoroughly to make sure they weren't dry or cracked. But for the cost, they should last more than three weeks. Wish I could return. I can't recommend now.",Yes,,Not Deleted,,,R2DO51B5JJUREO
,,B005JU5V6E,US,"Bosch ICON 21A Wiper Blade, Up to 40% Longer Life* - 21"" (Pack of 1)",https://www.amazon.com/gp/customer-reviews/R4FNKBYGPTEGZ,5.0,2016-10-05,https://www.amazon.com/gp/profile/amzn1.account.AHPZTCNF2ITM7ZJWNQOZIPC5ACMQ/ref=cm_cr_arp_d_gw_btm?ie=UTF8,Mf,AHPZTCNF2ITM7ZJWNQOZIPC5ACMQ,Loveeee these wipers I had no idea the difference good quality wipers like these could make in lieu of ...,"Loveeee these wipers I had no idea the difference good quality wipers like these could make in lieu of cheaper quality wipers! I was able to replace my old wipers with these in no more than 5 min per wiper.
Definitely worth the investment of you live in a place with a lot of snow and rain !!!
Fits perfectly on Jeep Patriot !",Yes,,Not Deleted,,,R4FNKBYGPTEGZ
,,B005JU5V6E,US,"Bosch ICON 21A Wiper Blade, Up to 40% Longer Life* - 21"" (Pack of 1)",https://www.amazon.com/gp/customer-reviews/R186UVLCPHPINR,5.0,2016-10-05,https://www.amazon.com/gp/profile/amzn1.account.AGCDYOUOOPXEO53YFH6LTNZYZ4CA/ref=cm_cr_arp_d_gw_btm?ie=UTF8,D.H.,AGCDYOUOOPXEO53YFH6LTNZYZ4CA,Five Stars,"As Expected, A+ Thanks!",Yes,,Not Deleted,,,R186UVLCPHPINR
,,B005JU5V6E,US,"Bosch ICON 21A Wiper Blade, Up to 40% Longer Life* - 21"" (Pack of 1)",https://www.amazon.com/gp/customer-reviews/R3SB9960WIMJCN,5.0,2016-09-14,https://www.amazon.com/gp/profile/amzn1.account.AE3KN4LQ4ZEKKIKAICBWYKRE2WOA/ref=cm_cr_arp_d_gw_btm?ie=UTF8,Kristan C,AE3KN4LQ4ZEKKIKAICBWYKRE2WOA,and my husband was grateful for how easy and quick they were to install,"I've had these for a couple weeks now and I can see a marked improvement from the ones I had before (ok, ok - I had the stock ones before. But still.) They work really well and have held up to the torrential downpours I have been receiving in my area of the Pacific Northwest. Very grateful for how well they work, and my husband was grateful for how easy and quick they were to install!",Yes,,Not Deleted,,,R3SB9960WIMJCN
,,B005JU5V6E,US,"Bosch ICON 21A Wiper Blade, Up to 40% Longer Life* - 21"" (Pack of 1)",https://www.amazon.com/gp/customer-reviews/R39A8Y8KZDTID8,5.0,2016-09-01,https://www.amazon.com/gp/profile/amzn1.account.AHBOWFXH5TEYXRAYUL4JL5HU3U3A/ref=cm_cr_arp_d_gw_btm?ie=UTF8,carbon,AHBOWFXH5TEYXRAYUL4JL5HU3U3A,Best I've found for Minnesota,These things just work. I live in Minnesota and regular blades ice up and/or dry out fast in the summer. I keep these on year round and they last about a year. Best I've found.,Yes,,Not Deleted,,,R39A8Y8KZDTID8
,,B005JU5V6E,US,"Bosch ICON 21A Wiper Blade, Up to 40% Longer Life* - 21"" (Pack of 1)",https://www.amazon.com/gp/customer-reviews/R3L1Y8EQVDXPM2,5.0,2016-08-26,https://www.amazon.com/gp/profile/amzn1.account.AG3LZMVS7GVDXLRMARZKACAT3LVQ/ref=cm_cr_arp_d_gw_btm?ie=UTF8,Mark,AG3LZMVS7GVDXLRMARZKACAT3LVQ,Excellent Product,Best wipers I've ever had.,Yes,,Not Deleted,,,R3L1Y8EQVDXPM2
,,B005JU5V6E,US,"Bosch ICON 21A Wiper Blade, Up to 40% Longer Life* - 21"" (Pack of 1)",https://www.amazon.com/gp/customer-reviews/R1K2VUT3UE9UTJ,5.0,2016-08-20,https://www.amazon.com/gp/profile/amzn1.account.AG6WQPIUAPZLRH27Y2BK7U4SNYBA/ref=cm_cr_arp_d_gw_btm?ie=UTF8,William Field,AG6WQPIUAPZLRH27Y2BK7U4SNYBA,Five Stars,"Great blade, easy install and good price.",Yes,,Not Deleted,,,R1K2VUT3UE9UTJ
,,B005JU5V6E,US,"Bosch ICON 21A Wiper Blade, Up to 40% Longer Life* - 21"" (Pack of 1)",https://www.amazon.com/gp/customer-reviews/R1ZXO1XDUKKWK3,4.0,2016-08-11,https://www.amazon.com/gp/profile/amzn1.account.AGP4YFO7EQ6FKM5UL26GBTHZHGKA/ref=cm_cr_arp_d_gw_btm?ie=UTF8,Dave Tainer,AGP4YFO7EQ6FKM5UL26GBTHZHGKA,Very good quality blades,"These are very good, though they replace old ones, so I don't know how well they are compared to the highest quality OEM. They definitely do the job well.",Yes,,Not Deleted,,,R1ZXO1XDUKKWK3
,,B005JU5V6E,US,"Bosch ICON 21A Wiper Blade, Up to 40% Longer Life* - 21"" (Pack of 1)",https://www.amazon.com/gp/customer-reviews/R3OC7UMH20EE5X,5.0,2016-08-08,https://www.amazon.com/gp/profile/amzn1.account.AHXLNIONKLQCH4ZB36NFUO5NZYAQ/ref=cm_cr_arp_d_gw_btm?ie=UTF8,Krazi Joe,AHXLNIONKLQCH4ZB36NFUO5NZYAQ,Five Stars,It moved the water off of the windshield.,Yes,,Not Deleted,,,R3OC7UMH20EE5X
,,B005JU5V6E,US,"Bosch ICON 21A Wiper Blade, Up to 40% Longer Life* - 21"" (Pack of 1)",https://www.amazon.com/gp/customer-reviews/R20Y7QFTDUWXZY,5.0,2016-07-19,https://www.amazon.com/gp/profile/amzn1.account.AGP6CRUUGQF57CMFJCOKENUIPKPQ/ref=cm_cr_arp_d_gw_btm?ie=UTF8,Jim Steyr,AGP6CRUUGQF57CMFJCOKENUIPKPQ,Five Stars,"excellent wiper blade.
well pleased with the transaction",Yes,,Not Deleted,,,R20Y7QFTDUWXZY
,,B005JU5V6E,US,"Bosch ICON 21A Wiper Blade, Up to 40% Longer Life* - 21"" (Pack of 1)",https://www.amazon.com/gp/customer-reviews/R19Z5KGA9IQLZS,5.0,2016-07-11,https://www.amazon.com/gp/profile/amzn1.account.AHCCC6VG2BYNVOKI6RDB6OC4IN4Q/ref=cm_cr_arp_d_gw_btm?ie=UTF8,TaiP,AHCCC6VG2BYNVOKI6RDB6OC4IN4Q,Better than all the rest!,"These are by far the best wipers I've purchased to date. I don't buy cheap blades, only the best and these are the best so far.",Yes,,Not Deleted,,,R19Z5KGA9IQLZS
,,B005JU5V6E,US,"Bosch ICON 21A Wiper Blade, Up to 40% Longer Life* - 21"" (Pack of 1)",https://www.amazon.com/gp/customer-reviews/R2ZX2SHJVFYOAU,1.0,2016-07-06,https://www.amazon.com/gp/profile/amzn1.account.AFJJY3LMZXN4CBKX5VQQCA5U6P5Q/ref=cm_cr_arp_d_gw_btm?ie=UTF8,ARTCC Controller,AFJJY3LMZXN4CBKX5VQQCA5U6P5Q,Not happy!,Squeak and leave rubber marks on windshield.  Not happy!,Yes,,Not Deleted,,,R2ZX2SHJVFYOAU
,,B005JU5V6E,US,"Bosch ICON 21A Wiper Blade, Up to 40% Longer Life* - 21"" (Pack of 1)",https://www.amazon.com/gp/customer-reviews/RY5AUU0RGTECW,5.0,2016-06-28,https://www.amazon.com/gp/profile/amzn1.account.AEYIBIEY72UWLZ7JCGZZB7IWO4WQ/ref=cm_cr_arp_d_gw_btm?ie=UTF8,Videomandan2385,AEYIBIEY72UWLZ7JCGZZB7IWO4WQ,Very high quality wipers!,"Went on easily, clears the windshield exceedingly well, and doesn't make any noise while wiping, even when dry (used during washer fluid squirt). Would highly recommend!",Yes,,Not Deleted,,,RY5AUU0RGTECW
,,B005JU5V6E,US,"Bosch ICON 21A Wiper Blade, Up to 40% Longer Life* - 21"" (Pack of 1)",https://www.amazon.com/gp/customer-reviews/R312DRJ9WPEOOX,3.0,2016-06-25,https://www.amazon.com/gp/profile/amzn1.account.AFINQUPYBVSBSPYROQ676FZ3D4XQ/ref=cm_cr_arp_d_gw_btm?ie=UTF8,Honestreview,AFINQUPYBVSBSPYROQ676FZ3D4XQ,"These are great blades, my only complaint is a part was ...","These are great blades,  my only complaint is a part was broken.  The blade should otherwise work well,  the previous ones have.",Yes,,Not Deleted,,,R312DRJ9WPEOOX
,,B005JU5V6E,US,"Bosch ICON 21A Wiper Blade, Up to 40% Longer Life* - 21"" (Pack of 1)",https://www.amazon.com/gp/customer-reviews/R1ENU5K86HH0XN,5.0,2016-06-23,https://www.amazon.com/gp/profile/amzn1.account.AFFNA24FFOIFWQ4AG52DA32NYVVA/ref=cm_cr_arp_d_gw_btm?ie=UTF8,Khalid Albarazi,AFFNA24FFOIFWQ4AG52DA32NYVVA,Five Stars,Useful,Yes,,Not Deleted,,,R1ENU5K86HH0XN
,,B005JU5V6E,US,"Bosch ICON 21A Wiper Blade, Up to 40% Longer Life* - 21"" (Pack of 1)",https://www.amazon.com/gp/customer-reviews/R3UH26KXH41MOK,5.0,2016-06-16,https://www.amazon.com/gp/profile/amzn1.account.AE3K6EFDVMO4A4XTLNQHGITH2Y7Q/ref=cm_cr_arp_d_gw_btm?ie=UTF8,ShiftSe7en,AE3K6EFDVMO4A4XTLNQHGITH2Y7Q,A better blade. You get what you pay for.,"These work great on my Volkswagon and half the price of the wiper blades I used to be forced to buy from the dealer.
Literal side-by side performance test / comparison:
I'm returning to these Bosch Icons again after putting a pair of these on the driver side over a year ago. At that time, I had an extra cheaper, Anco brand wiper blade that I put on the passenger side at the exact same time — The Anco lasted less than half the time of the Bosch Icon, and was much more prone, even when newer, to streak, squawk and jutter over the glass. The Bosch Icons were just noticeably better — especially in light, intermittent rain, and they really shined over the Ancos in the winter with snow and ice.
These are more expensive, but last longer and have noticeably better performance. I find that these also respond well to reconditioning if you clean them well with alcohol periodically.",Yes,,Not Deleted,,,R3UH26KXH41MOK
,,B005JU5V6E,US,"Bosch ICON 21A Wiper Blade, Up to 40% Longer Life* - 21"" (Pack of 1)",https://www.amazon.com/gp/customer-reviews/R3DSKB6AIOR84Y,5.0,2016-06-05,https://www.amazon.com/gp/profile/amzn1.account.AHEVVG6U7K3TPULB5LLEMTFLQ2YA/ref=cm_cr_arp_d_gw_btm?ie=UTF8,Big Z,AHEVVG6U7K3TPULB5LLEMTFLQ2YA,Five Stars,Love them! Best wipers i have ever owned!,Yes,,Not Deleted,,,R3DSKB6AIOR84Y
,,B005JU5V6E,US,"Bosch ICON 21A Wiper Blade, Up to 40% Longer Life* - 21"" (Pack of 1)",https://www.amazon.com/gp/customer-reviews/R214WICAKSGV37,5.0,2016-05-18,https://www.amazon.com/gp/profile/amzn1.account.AFMMLA53M6W4TI776VCX4DZ7IKJA/ref=cm_cr_arp_d_gw_btm?ie=UTF8,Carroll,AFMMLA53M6W4TI776VCX4DZ7IKJA,Five Stars,Great wiper blades!,Yes,,Not Deleted,,,R214WICAKSGV37
,,B005JU5V6E,US,"Bosch ICON 21A Wiper Blade, Up to 40% Longer Life* - 21"" (Pack of 1)",https://www.amazon.com/gp/customer-reviews/R1G728BQ88JPZD,5.0,2016-05-17,https://www.amazon.com/gp/profile/amzn1.account.AE23QJTSRREJUABESGYJADGV5Z3A/ref=cm_cr_arp_d_gw_btm?ie=UTF8,Blake Holman,AE23QJTSRREJUABESGYJADGV5Z3A,Simply the Best,Simply the best,Yes,,Not Deleted,,,R1G728BQ88JPZD
,,B005JU5V6E,US,"Bosch ICON 21A Wiper Blade, Up to 40% Longer Life* - 21"" (Pack of 1)",https://www.amazon.com/gp/customer-reviews/R263REZMTUFCO0,5.0,2016-05-16,https://www.amazon.com/gp/profile/amzn1.account.AG26P4O2H5A3ZGD7AQIH5QGT4VOQ/ref=cm_cr_arp_d_gw_btm?ie=UTF8,JD,AG26P4O2H5A3ZGD7AQIH5QGT4VOQ,Excellent Wipers. Fitted on a 07 Grand Cherokee WK,"Buy two ICON Wipers (21A and 21B) for my 2007 Grand Cherokee WK, they are very good wipers, installation is easy, the fitment is very good (almost perfect in my car) they performance is also very good, and they are quiet. I will probably buy this in the future hoping to get at least 3 years of this first pair.
After some rain and regular use, they are still strong! will update in the future.
UPDATE 24 Dec 2020: I bought my first pair of Bosch ICON (21A & 21B) on July 05 2015! and yesterday 24 Dec 2020 I found myself in the need of a replacement pair, they perform flawlessly until around 2019 from around that time I  did notice they start to leave some minors strikes and this last winter (June - July 2020 In my country) I said to myself well I need to buy a replacement pair BUT wanted to see how much they last, so finally the driver side one broke (no cracks) but it when I lifted the wiper arm the rubber came stucked (due to bird crap) to the windshield and separate from the wiper frame. fair enough since 2018 the car is parked on street level  WITHOUT shade so the wipers had endured a lot of heat.  I did do some cleanings with alcohol but the maintenance was minimum so this worth the extra cost for peace of mind, durability, and performance.",Yes,,Not Deleted,,,R263REZMTUFCO0
,,B005JU5V6E,US,"Bosch ICON 21A Wiper Blade, Up to 40% Longer Life* - 21"" (Pack of 1)",https://www.amazon.com/gp/customer-reviews/R3C01MGJ9P5RNM,5.0,2016-05-16,https://www.amazon.com/gp/profile/amzn1.account.AE7EEKWNHMFS5R7NCAD3UEZPFAYQ/ref=cm_cr_arp_d_gw_btm?ie=UTF8,LEONARD HIGBEE,AE7EEKWNHMFS5R7NCAD3UEZPFAYQ,Five Stars,These Bosch ICON Wiper Blade are the best.,Yes,,Not Deleted,,,R3C01MGJ9P5RNM
,,B005JU5V6E,US,"Bosch ICON 21A Wiper Blade, Up to 40% Longer Life* - 21"" (Pack of 1)",https://www.amazon.com/gp/customer-reviews/RJZQLOQ2L03U1,5.0,2016-05-11,https://www.amazon.com/gp/profile/amzn1.account.AH2ARYJI7GS6ICU2Z43LRYMYWOCA/ref=cm_cr_arp_d_gw_btm?ie=UTF8,Aaron Schug,AH2ARYJI7GS6ICU2Z43LRYMYWOCA,These Are the Best!,"These are some of the best windshield wipers on you can get. They ""mold"" to the windshield so much better than the cheaper versions that are built with metal. They also last a really long time. I haven't had to change these out for over a year now, and the ones I had before this lasted over a year and a half! You cant beat the quality, or the performance!",Yes,,Not Deleted,,,RJZQLOQ2L03U1
,,B005JU5V6E,US,"Bosch ICON 21A Wiper Blade, Up to 40% Longer Life* - 21"" (Pack of 1)",https://www.amazon.com/gp/customer-reviews/R14KX6CQO11O5I,5.0,2016-05-07,https://www.amazon.com/gp/profile/amzn1.account.AF3XYXRF5K5UBQ7RGN2SC7CXX66A/ref=cm_cr_arp_d_gw_btm?ie=UTF8,jose nunez,AF3XYXRF5K5UBQ7RGN2SC7CXX66A,Five Stars,Yes,No,,Not Deleted,,,R14KX6CQO11O5I
,,B005JU5V6E,US,"Bosch ICON 21A Wiper Blade, Up to 40% Longer Life* - 21"" (Pack of 1)",https://www.amazon.com/gp/customer-reviews/R3SLH28ED273HV,3.0,2016-05-06,https://www.amazon.com/gp/profile/amzn1.account.AGQXMD437SIMNCF6CH7C5PXXKUNQ/ref=cm_cr_arp_d_gw_btm?ie=UTF8,salvia06,AGQXMD437SIMNCF6CH7C5PXXKUNQ,keep a spare handy -- you may need it long before you think you might,"i purchased 4 of these four months ago to install on my two Volvo 850. Very nice wipers but the other day on blade lost half of it's edge. Fortunately, the rain was not too heavy, and the remaining half cleared enough of windshield for me to get home safely. Just ordered a replacement...",Yes,,Not Deleted,,,R3SLH28ED273HV
,,B005JU5V6E,US,"Bosch ICON 21A Wiper Blade, Up to 40% Longer Life* - 21"" (Pack of 1)",https://www.amazon.com/gp/customer-reviews/RJ38K14IMH630,3.0,2016-05-03,https://www.amazon.com/gp/profile/amzn1.account.AFQUKK77ZN2HMXLWLZW36T43QPHA/ref=cm_cr_arp_d_gw_btm?ie=UTF8,Deserteagle,AFQUKK77ZN2HMXLWLZW36T43QPHA,I was disappointed to see that so early on,After a few weeks now I'm noticing some streaks when I turn on my wipers. I was disappointed to see that so early on.,Yes,,Not Deleted,,,RJ38K14IMH630
,,B005JU5V6E,US,"Bosch ICON 21A Wiper Blade, Up to 40% Longer Life* - 21"" (Pack of 1)",https://www.amazon.com/gp/customer-reviews/R238XM6L447JCO,5.0,2016-04-25,https://www.amazon.com/gp/profile/amzn1.account.AGDV7NUKF3QYXXUIM4CPRVUHZZPA/ref=cm_cr_arp_d_gw_btm?ie=UTF8,Lucy,AGDV7NUKF3QYXXUIM4CPRVUHZZPA,"Thanks, Amazon!","They arrived when expected, were exactly what I wanted and needed, and were easy to install.",Yes,,Not Deleted,,,R238XM6L447JCO
,,B005JU5V6E,US,"Bosch ICON 21A Wiper Blade, Up to 40% Longer Life* - 21"" (Pack of 1)",https://www.amazon.com/gp/customer-reviews/R1BZG062D6NEWR,5.0,2016-04-25,https://www.amazon.com/gp/profile/amzn1.account.AGNJNQUWH2DAOTRGGI4EYF7XWIQQ/ref=cm_cr_arp_d_gw_btm?ie=UTF8,Amazon Customer,AGNJNQUWH2DAOTRGGI4EYF7XWIQQ,Five Stars,The best,Yes,,Not Deleted,,,R1BZG062D6NEWR
,,B005JU5V6E,US,"Bosch ICON 21A Wiper Blade, Up to 40% Longer Life* - 21"" (Pack of 1)",https://www.amazon.com/gp/customer-reviews/R3AAIW1I3RBX6H,5.0,2016-04-24,https://www.amazon.com/gp/profile/amzn1.account.AGEHSNWJNFJSB6BKSCRQYKNNYL5A/ref=cm_cr_arp_d_gw_btm?ie=UTF8,DC Goswami,AGEHSNWJNFJSB6BKSCRQYKNNYL5A,These set of blades might have cost me total of 30 dollars but I know it will easily last me 2 years,"I got this blade to replace a Bosch blade that I believe was originally changed in 2003 on a 1998 Toyota Avalon, it was garage kept and actually removed the rain well, but recently made streaks on my windows. I had the car for over a year and now am I changing some of the little parts. These set of blades might have cost me total of 30 dollars but I know it will easily last me 2 years. They are extremely well built and very sturdy. When it was raining, cleared the rain very well.",Yes,,Not Deleted,,,R3AAIW1I3RBX6H
,,B005JU5V6E,US,"Bosch ICON 21A Wiper Blade, Up to 40% Longer Life* - 21"" (Pack of 1)",https://www.amazon.com/gp/customer-reviews/R18W5B82IHXZFG,5.0,2016-04-23,https://www.amazon.com/gp/profile/amzn1.account.AHUL523KKRKS6GUB2HITZRKIWUFQ/ref=cm_cr_arp_d_gw_btm?ie=UTF8,Wetpaws,AHUL523KKRKS6GUB2HITZRKIWUFQ,Good wipers for you windshield,Great wipers does a good job of clearing my windsield,Yes,,Not Deleted,,,R18W5B82IHXZFG
,,B005JU5V6E,US,"Bosch ICON 21A Wiper Blade, Up to 40% Longer Life* - 21"" (Pack of 1)",https://www.amazon.com/gp/customer-reviews/R2P0T3YL1VKPVO,5.0,2016-04-22,https://www.amazon.com/gp/profile/amzn1.account.AGZLQ47VVWQLFS6K2VGHLQ7UTZTQ/ref=cm_cr_arp_d_gw_btm?ie=UTF8,Jason,AGZLQ47VVWQLFS6K2VGHLQ7UTZTQ,Best blades money can buy!,I have used these blades on 6+ cars I have owned in the past 10 years and the always work awesome. I usually replace blades every year because in MN we have extreme conditions on both ends of the spectrum. They hold up great in ice storms and don't wear bad in 100deg sunny days. I recommend them for all users.,Yes,,Not Deleted,,,R2P0T3YL1VKPVO
,,B005JU5V6E,US,"Bosch ICON 21A Wiper Blade, Up to 40% Longer Life* - 21"" (Pack of 1)",https://www.amazon.com/gp/customer-reviews/RG8OKMO5PS6FQ,5.0,2016-04-20,https://www.amazon.com/gp/profile/amzn1.account.AFKTNTQNBOFVTORH2I5QPSZGENFQ/ref=cm_cr_arp_d_gw_btm?ie=UTF8,G. Martin,AFKTNTQNBOFVTORH2I5QPSZGENFQ,The Best!,"These are by far my favorite wiper blades.  I've tried many over the years, but these Bosch ICON's are just the best.  The weighted tips guarantee that the entire wiper blade will be in contact with the windshield.  In operation, they're extremely quiet and scoop off every bit of moisture with each pass.
Installing them is very simple once you figure out their slightly obtuse clip system.  You have to pinch in on the ridged sides to pop open the clip.  Slide them onto your wiper arms and then close the clip back down.",Yes,,Not Deleted,,,RG8OKMO5PS6FQ
,,B005JU5V6E,US,"Bosch ICON 21A Wiper Blade, Up to 40% Longer Life* - 21"" (Pack of 1)",https://www.amazon.com/gp/customer-reviews/R2RZ3006MQYKBN,5.0,2016-04-17,https://www.amazon.com/gp/profile/amzn1.account.AHYF4E2A2EWGEB3JZXGYVGI7CAZA/ref=cm_cr_arp_d_gw_btm?ie=UTF8,Jagman,AHYF4E2A2EWGEB3JZXGYVGI7CAZA,"Um, it's s Wiper and it Wipes off Water.  Works Fine.",Cleans water off of windshield.,Yes,,Not Deleted,,,R2RZ3006MQYKBN
