category,product_custom_name,asin,country_code,product_title,review_url,review_rating,review_date,reviewer_url,reviewer_name,reviewer_id,review_title,review_text,review_verified,variation_asin,deleted,deleted_datetime,product_attributes,amazon_review_id
,,B005JU5V6E,US,"Bosch ICON 21A Wiper Blade, Up to 40% Longer Life* - 21"" (Pack of 1)",https://www.amazon.com/gp/customer-reviews/R2W6EO9FL0I81E,4.0,2015-02-14,https://www.amazon.com/gp/profile/amzn1.account.AHLSG2Y53QTFNBK7OQHDRMHE4NVA/ref=cm_cr_arp_d_gw_btm?ie=UTF8,Raymond Jann,AHLSG2Y53QTFNBK7OQHDRMHE4NVA,Four Stars,does as described,Yes,,Not Deleted,,,R2W6EO9FL0I81E
,,B005JU5V6E,US,"Bosch ICON 21A Wiper Blade, Up to 40% Longer Life* - 21"" (Pack of 1)",https://www.amazon.com/gp/customer-reviews/R1ADYCT9U1JO1X,5.0,2015-02-13,https://www.amazon.com/gp/profile/amzn1.account.AGHKH4SCFDVN3IDDP7XYVOLOOJMQ/ref=cm_cr_arp_d_gw_btm?ie=UTF8,macskills,AGHKH4SCFDVN3IDDP7XYVOLOOJMQ,Excellent wipers - quality build and a step above others. Spend the extra money for safety.,Excellent wipers - quality build and design a step above others. VERY quiet operation because they fit your windshield so good. Spend the extra money for your safety. These are very well designed and fit the glass curve better than any wiper I've purchased- these destroy Rain-X wipers by a long shot. Go for it you won't be disappointed.,Yes,,Not Deleted,,,R1ADYCT9U1JO1X
,,B005JU5V6E,US,"Bosch ICON 21A Wiper Blade, Up to 40% Longer Life* - 21"" (Pack of 1)",https://www.amazon.com/gp/customer-reviews/R2X13DP4GUXBQ9,5.0,2015-02-13,https://www.amazon.com/gp/profile/amzn1.account.AEBMLBQAF4O3N45GMSJCB4TM4SWA/ref=cm_cr_arp_d_gw_btm?ie=UTF8,Mr. D,AEBMLBQAF4O3N45GMSJCB4TM4SWA,All these Bosch Icon wipers are the best. I use them in both cars and they ...,"All these Bosch Icon wipers are the best. I use them in both cars and they pay for themselves in how clean they swipe and their life. Live in Seattle, so I know about wipers!",Yes,,Not Deleted,,,R2X13DP4GUXBQ9
,,B005JU5V6E,US,"Bosch ICON 21A Wiper Blade, Up to 40% Longer Life* - 21"" (Pack of 1)",https://www.amazon.com/gp/customer-reviews/R1E2W2PHNV4CQD,5.0,2015-02-12,https://www.amazon.com/gp/profile/amzn1.account.AHO3XA4XRGETCG64PV7DWPVCMOUA/ref=cm_cr_arp_d_gw_btm?ie=UTF8,Peter_the_Gr8,AHO3XA4XRGETCG64PV7DWPVCMOUA,Installation was really easy (taking the old ones off was more difficult,Installation was really easy (taking the old ones off was more difficult.) Am using in harsh Massachusetts winter and they are working great.,Yes,,Not Deleted,,,R1E2W2PHNV4CQD
,,B005JU5V6E,US,"Bosch ICON 21A Wiper Blade, Up to 40% Longer Life* - 21"" (Pack of 1)",https://www.amazon.com/gp/customer-reviews/R26LJHE40BQZK8,5.0,2015-02-10,https://www.amazon.com/gp/profile/amzn1.account.AGIGID4ONIOTAH6AJLVVGTM4WHSA/ref=cm_cr_arp_d_gw_btm?ie=UTF8,jsbeall,AGIGID4ONIOTAH6AJLVVGTM4WHSA,Five Stars,Easy to install & great wipers!,Yes,,Not Deleted,,,R26LJHE40BQZK8
,,B005JU5V6E,US,"Bosch ICON 21A Wiper Blade, Up to 40% Longer Life* - 21"" (Pack of 1)",https://www.amazon.com/gp/customer-reviews/R29OO8Z7Y69XB0,5.0,2015-01-30,https://www.amazon.com/gp/profile/amzn1.account.AH5OMGIFUWDZXG2MD2ZBQJGZVL7A/ref=cm_cr_arp_d_gw_btm?ie=UTF8,Emmy O.,AH5OMGIFUWDZXG2MD2ZBQJGZVL7A,Five Stars,This works great with my Subaru. Made a huge difference in visibility!,Yes,,Not Deleted,,,R29OO8Z7Y69XB0
,,B005JU5V6E,US,"Bosch ICON 21A Wiper Blade, Up to 40% Longer Life* - 21"" (Pack of 1)",https://www.amazon.com/gp/customer-reviews/R1B510SUVWNW1S,4.0,2015-01-29,https://www.amazon.com/gp/profile/amzn1.account.AELWLM37JNPAJYTG5GMQWGVEOQLA/ref=cm_cr_arp_d_gw_btm?ie=UTF8,Austin G.,AELWLM37JNPAJYTG5GMQWGVEOQLA,Four Stars,a,Yes,,Not Deleted,,,R1B510SUVWNW1S
,,B005JU5V6E,US,"Bosch ICON 21A Wiper Blade, Up to 40% Longer Life* - 21"" (Pack of 1)",https://www.amazon.com/gp/customer-reviews/R3J6K56STU4RJ7,5.0,2015-01-28,https://www.amazon.com/gp/profile/amzn1.account.AGBWLHCW5HVQTFY3NOYP5QHQYQ7A/ref=cm_cr_arp_d_gw_btm?ie=UTF8,Leland C,AGBWLHCW5HVQTFY3NOYP5QHQYQ7A,So far so good,Pretty easy installation per the instructions.  But Youtube videos are better.  No more streaks.  Consistent wipe.  Not sure how long these will last.  I hope it lasts 4 years as OEM Toyota refills are 1/2 the cost and lasts about 2 years.,Yes,,Not Deleted,,,R3J6K56STU4RJ7
,,B005JU5V6E,US,"Bosch ICON 21A Wiper Blade, Up to 40% Longer Life* - 21"" (Pack of 1)",https://www.amazon.com/gp/customer-reviews/R30IZ8V56C1LBA,5.0,2015-01-27,https://www.amazon.com/gp/profile/amzn1.account.AE3J22XCXXKWIQE3HPHH74I3XGHQ/ref=cm_cr_arp_d_gw_btm?ie=UTF8,Gear Maven,AE3J22XCXXKWIQE3HPHH74I3XGHQ,Five Stars,Excellent and prompt service. I would definitely purchase again/recommend ( and I have- this is 3rd pair at least!!),Yes,,Not Deleted,,,R30IZ8V56C1LBA
,,B005JU5V6E,US,"Bosch ICON 21A Wiper Blade, Up to 40% Longer Life* - 21"" (Pack of 1)",https://www.amazon.com/gp/customer-reviews/RDKPMLUIGKQRR,5.0,2015-01-27,https://www.amazon.com/gp/profile/amzn1.account.AGN4W6JEZH3PFFXLOXU4PCI6G7XQ/ref=cm_cr_arp_d_gw_btm?ie=UTF8,Larry,AGN4W6JEZH3PFFXLOXU4PCI6G7XQ,Five Stars,Fits perfectly on my 2010 Taco.,Yes,,Not Deleted,,,RDKPMLUIGKQRR
,,B005JU5V6E,US,"Bosch ICON 21A Wiper Blade, Up to 40% Longer Life* - 21"" (Pack of 1)",https://www.amazon.com/gp/customer-reviews/R1H7Z4KAWBL2DQ,5.0,2015-01-26,https://www.amazon.com/gp/profile/amzn1.account.AGVXITCVD5E37BYUJI3PGACMAMDQ/ref=cm_cr_arp_d_gw_btm?ie=UTF8,galactic,AGVXITCVD5E37BYUJI3PGACMAMDQ,Wipes clean and smoothly,"I replaced my wipers the day it was going to rain.  Good thing I did, because the Bosch Icon really has a clean and smooth wipe on my windshield.",Yes,,Not Deleted,,,R1H7Z4KAWBL2DQ
,,B005JU5V6E,US,"Bosch ICON 21A Wiper Blade, Up to 40% Longer Life* - 21"" (Pack of 1)",https://www.amazon.com/gp/customer-reviews/R1HJC3HPW1SWS7,2.0,2015-01-26,https://www.amazon.com/gp/profile/amzn1.account.AH3HSCLBE7AYXI5U7H4AVF5KH7CA/ref=cm_cr_arp_d_gw_btm?ie=UTF8,Motsyball,AH3HSCLBE7AYXI5U7H4AVF5KH7CA,Only lasted a few months. Before the first frost ...,Only lasted a few months.  Before the first frost they were already worn leaving streaks.  Don't know if its real Bosch or a knock off but don't think I'll try it again.,Yes,,Not Deleted,,,R1HJC3HPW1SWS7
,,B005JU5V6E,US,"Bosch ICON 21A Wiper Blade, Up to 40% Longer Life* - 21"" (Pack of 1)",https://www.amazon.com/gp/customer-reviews/R31FDB77LTU8EO,5.0,2015-01-25,https://www.amazon.com/gp/profile/amzn1.account.AHCAI5NZODZUBOUUFGMHJHS7L7KQ/ref=cm_cr_arp_d_gw_btm?ie=UTF8,Heather M,AHCAI5NZODZUBOUUFGMHJHS7L7KQ,Really love these blades,"Really love these blades.  The squeak is gone, no jumping, and removes the water.  For the price, I think they should also clear the water off the side windows, but the windshield will have to do.  I would definitely have my husband spend his money for these blades again.",Yes,,Not Deleted,,,R31FDB77LTU8EO
,,B005JU5V6E,US,"Bosch ICON 21A Wiper Blade, Up to 40% Longer Life* - 21"" (Pack of 1)",https://www.amazon.com/gp/customer-reviews/R121QO16HNDRLL,5.0,2015-01-24,https://www.amazon.com/gp/profile/amzn1.account.AHHOU4IBG4DGLQIXVCUJBZFP2HDA/ref=cm_cr_arp_d_gw_btm?ie=UTF8,Gregory M. Bruening,AHHOU4IBG4DGLQIXVCUJBZFP2HDA,Smooth action and clean wiping,I've been buying Rain-X forever but these beat the pants off of any RX wipers I've bought. Super smooth action on the windshield with absolutely no drag - even after a night of snow/sleet.,Yes,,Not Deleted,,,R121QO16HNDRLL
,,B005JU5V6E,US,"Bosch ICON 21A Wiper Blade, Up to 40% Longer Life* - 21"" (Pack of 1)",https://www.amazon.com/gp/customer-reviews/R26BAM2Y1M3KV7,5.0,2015-01-18,https://www.amazon.com/gp/profile/amzn1.account.AH3TWYD4HD4D56WUJURFQYK35OUA/ref=cm_cr_arp_d_gw_btm?ie=UTF8,Kurt K,AH3TWYD4HD4D56WUJURFQYK35OUA,Best blades on the market.,These are the best!  I've had them for a couple of months now in the winter months in Minnesota and they work great.,Yes,,Not Deleted,,,R26BAM2Y1M3KV7
,,B005JU5V6E,US,"Bosch ICON 21A Wiper Blade, Up to 40% Longer Life* - 21"" (Pack of 1)",https://www.amazon.com/gp/customer-reviews/R382Y14F9YU8M6,4.0,2015-01-18,https://www.amazon.com/gp/profile/amzn1.account.AEKYO5DA2BVNJE5R7WE3YDVH3XPA/ref=cm_cr_arp_d_gw_btm?ie=UTF8,Rob,AEKYO5DA2BVNJE5R7WE3YDVH3XPA,Four Stars,Very easy to install and much higher quality than OEM.,Yes,,Not Deleted,,,R382Y14F9YU8M6
,,B005JU5V6E,US,"Bosch ICON 21A Wiper Blade, Up to 40% Longer Life* - 21"" (Pack of 1)",https://www.amazon.com/gp/customer-reviews/R3K30RUIW33MO8,4.0,2015-01-16,https://www.amazon.com/gp/profile/amzn1.account.AG5OPUXQIOTJUUWR4H623ZX6KRYQ/ref=cm_cr_arp_d_gw_btm?ie=UTF8,ohioan,AG5OPUXQIOTJUUWR4H623ZX6KRYQ,i really liked these wipers,"i really liked these wipers. but they only last about a year if not less. I always used generic brand wipers and they worked ok. They would leave streaks but nothing that would prevent me from seeing the road. I used michelin brand wipers and they didn't work very well. They left a lot of streaks and didn't clean the windshield very well. These wipers clean the windshield completely, very well and no streaks, they are also very quiet. I bought them in the spring of last year, and now they are done with. I live in ohio and having good wipers is essential. We get really bad snow and ice and salt is always everywhere.  Also they cleaned my windshield and left a huge streak down the middle exactly where i needed to see the road.  But they are a year old now so they lasted pretty good amount of time. These are wonderful wipers if you want to spend a good amount. They could last a very long time if you don't get as much snow or ice. But they don't last as long as a year if not less. they are very quiet. and they also look kinda bulky on the windshield. I would definitely recommend them.",No,,Not Deleted,,,R3K30RUIW33MO8
,,B005JU5V6E,US,"Bosch ICON 21A Wiper Blade, Up to 40% Longer Life* - 21"" (Pack of 1)",https://www.amazon.com/gp/customer-reviews/R2L3V28U1TLY9N,2.0,2015-01-12,https://www.amazon.com/gp/profile/amzn1.account.AEY2IC6JY4AUH6HIAUPR5JC3SYXA/ref=cm_cr_arp_d_gw_btm?ie=UTF8,Brendan J. Ewing,AEY2IC6JY4AUH6HIAUPR5JC3SYXA,... a full year later they stopped being even slightly good on rain clearing,less than a full year later they stopped being even slightly good on rain clearing. i can barely see out my windshield during the rain. on the passanger side it's far worse.,Yes,,Not Deleted,,,R2L3V28U1TLY9N
,,B005JU5V6E,US,"Bosch ICON 21A Wiper Blade, Up to 40% Longer Life* - 21"" (Pack of 1)",https://www.amazon.com/gp/customer-reviews/R3MCF72Z4S7UNY,5.0,2015-01-12,https://www.amazon.com/gp/profile/amzn1.account.AFD6SIMF2YKZA7T5QRY2QF6GTYXA/ref=cm_cr_arp_d_gw_btm?ie=UTF8,Jonathan,AFD6SIMF2YKZA7T5QRY2QF6GTYXA,Five Stars,Works well and cannot complain. I will probably never go with traditional wiper blades again.,Yes,,Not Deleted,,,R3MCF72Z4S7UNY
,,B005JU5V6E,US,"Bosch ICON 21A Wiper Blade, Up to 40% Longer Life* - 21"" (Pack of 1)",https://www.amazon.com/gp/customer-reviews/RJ0K48136THSF,5.0,2015-01-12,https://www.amazon.com/gp/profile/amzn1.account.AGCWIUARBCDEHUKRZEQ4CQKMCH6Q/ref=cm_cr_arp_d_gw_btm?ie=UTF8,Do Kap kim,AGCWIUARBCDEHUKRZEQ4CQKMCH6Q,Five Stars,excellent,Yes,,Not Deleted,,,RJ0K48136THSF
,,B005JU5V6E,US,"Bosch ICON 21A Wiper Blade, Up to 40% Longer Life* - 21"" (Pack of 1)",https://www.amazon.com/gp/customer-reviews/RZGSMX4HTYPU,5.0,2015-01-03,https://www.amazon.com/gp/profile/amzn1.account.AGHOV6E3X2FHTVE5EWWNSZQZC3EQ/ref=cm_cr_arp_d_gw_btm?ie=UTF8,DT,AGHOV6E3X2FHTVE5EWWNSZQZC3EQ,WENT BACK TO BOSCH ICON,"WHEN IN DOUBT, GET BOSCH. THEY DON'T SQUEAK. THEY WIPE THE BEST AND LAST LONG. EASY TO MOUNT.I TRIED EVERYTHING ELSE BUT NO LUCK.",Yes,,Not Deleted,,,RZGSMX4HTYPU
,,B005JU5V6E,US,"Bosch ICON 21A Wiper Blade, Up to 40% Longer Life* - 21"" (Pack of 1)",https://www.amazon.com/gp/customer-reviews/R8QLMVHIUFG75,5.0,2014-12-31,https://www.amazon.com/gp/profile/amzn1.account.AE7QEC33PNZNNXAKI5O2S7LZ5ZUA/ref=cm_cr_arp_d_gw_btm?ie=UTF8,J,AE7QEC33PNZNNXAKI5O2S7LZ5ZUA,Five Stars,"Best wipers on the market, easy install too.",Yes,,Not Deleted,,,R8QLMVHIUFG75
,,B005JU5V6E,US,"Bosch ICON 21A Wiper Blade, Up to 40% Longer Life* - 21"" (Pack of 1)",https://www.amazon.com/gp/customer-reviews/R13OXJGBVVKNGY,5.0,2014-12-30,https://www.amazon.com/gp/profile/amzn1.account.AFVAJTYULK2TWCTVL326FEMYDJIQ/ref=cm_cr_arp_d_gw_btm?ie=UTF8,turbo54,AFVAJTYULK2TWCTVL326FEMYDJIQ,Excellent wipers,"These are great wipers. I bought this as a replacement for the same wiper that was 6 or 7 years old. I remember the wiper being excellent when new, but over the last year or so they've been really lousy. Still, 4-5 years of good performance is totally satisfactory.
With the new replacement, I am extremely pleased at the streak-free, quiet and smooth operation.
Vehicle is a 1995 Subaru Legacy.",Yes,,Not Deleted,,,R13OXJGBVVKNGY
,,B005JU5V6E,US,"Bosch ICON 21A Wiper Blade, Up to 40% Longer Life* - 21"" (Pack of 1)",https://www.amazon.com/gp/customer-reviews/R317NG07G13SED,5.0,2014-12-29,https://www.amazon.com/gp/profile/amzn1.account.AFBZOV75VKA5ODOENUOFP3MTXSWQ/ref=cm_cr_arp_d_gw_btm?ie=UTF8,SDN,AFBZOV75VKA5ODOENUOFP3MTXSWQ,Great Wipers,"This is the fifth pair of these wipers that I have purchased.  They last about a year, the performance makes them worth the price. I like to contour on the top of the blades, it helps hold them down at highways speeds, improving performance in heavy downpours",Yes,,Not Deleted,,,R317NG07G13SED
,,B005JU5V6E,US,"Bosch ICON 21A Wiper Blade, Up to 40% Longer Life* - 21"" (Pack of 1)",https://www.amazon.com/gp/customer-reviews/R20IUMKR03OQLU,5.0,2014-12-24,https://www.amazon.com/gp/profile/amzn1.account.AGY3QWMQX3M3BIY5AU25TDAYG3PQ/ref=cm_cr_arp_d_gw_btm?ie=UTF8,Andy T,AGY3QWMQX3M3BIY5AU25TDAYG3PQ,I'll never buy that other brand that starts with 'R' ...,"I'll never buy that other brand that starts with 'R' and ends in 'X' after using these. These are completely smooth and quiet compared to the others I've used, and it appears that they're going to last way longer. Installation was a breeze. I wish I had used these wipers for years, as the other brand I've been using doesn't have any kind of cover for the J-hook, leaving mine chipped and rusted after being exposed to the elements. These are definitely worth the few extra bucks.",Yes,,Not Deleted,,,R20IUMKR03OQLU
,,B005JU5V6E,US,"Bosch ICON 21A Wiper Blade, Up to 40% Longer Life* - 21"" (Pack of 1)",https://www.amazon.com/gp/customer-reviews/R2YRL3CLWPXSS0,5.0,2014-12-23,https://www.amazon.com/gp/profile/amzn1.account.AGYCRAVAZFXY4REVBZAV6RFZEDKQ/ref=cm_cr_arp_d_gw_btm?ie=UTF8,B12,AGYCRAVAZFXY4REVBZAV6RFZEDKQ,High quality windshield wipers,You get what you pay for. I have had these for a couple of months now and they are still amazing and give you a very clear view on bad weather days with absolutely no streaks. You can tell the higher quality right out of the box and they are easy to install. I will definitely buy these going forward for my 2006 Jeep Grand Cherokee.,Yes,,Not Deleted,,,R2YRL3CLWPXSS0
,,B005JU5V6E,US,"Bosch ICON 21A Wiper Blade, Up to 40% Longer Life* - 21"" (Pack of 1)",https://www.amazon.com/gp/customer-reviews/R2QLFO20OURJLB,5.0,2014-12-20,https://www.amazon.com/gp/profile/amzn1.account.AGW6IKTTOB6TZ72XGCEIRSHF76XQ/ref=cm_cr_arp_d_gw_btm?ie=UTF8,DJ,AGW6IKTTOB6TZ72XGCEIRSHF76XQ,No need for winter blades!,"I found these a couple of years ago by accident and couldn't be more pleased. There isn't a lot to say about windshield wipers but here goes.  They maintain contact with the windshield at high speeds, don't gather ice or snow, and most importantly, leave no streaks or chatter marks. It sounds rediculous but after riding in my brothers truck in the rain, there is a set under the Christmas tree for him now.",Yes,,Not Deleted,,,R2QLFO20OURJLB
,,B005JU5V6E,US,"Bosch ICON 21A Wiper Blade, Up to 40% Longer Life* - 21"" (Pack of 1)",https://www.amazon.com/gp/customer-reviews/R3A0ON8DWWTFMQ,5.0,2014-12-19,https://www.amazon.com/gp/profile/amzn1.account.AGQX2P6JCX3JW4F5AWQA2I4V7XUQ/ref=cm_cr_arp_d_gw_btm?ie=UTF8,Jeff,AGQX2P6JCX3JW4F5AWQA2I4V7XUQ,Good blades,These are vastly better than the old Bosch blades. Extremely easy to mount on my Audi A4,Yes,,Not Deleted,,,R3A0ON8DWWTFMQ
,,B005JU5V6E,US,"Bosch ICON 21A Wiper Blade, Up to 40% Longer Life* - 21"" (Pack of 1)",https://www.amazon.com/gp/customer-reviews/RADB2N5931DYS,5.0,2014-12-17,https://www.amazon.com/gp/profile/amzn1.account.AER5QTRQNB4FBE7APAD67JXIVARQ/ref=cm_cr_arp_d_gw_btm?ie=UTF8,DL,AER5QTRQNB4FBE7APAD67JXIVARQ,Great quality and very easy to install,"Great quality and very easy to install. No streaking or chattering of the blade after almost 3 months of use. The Rain-X blades I had before streaked right out of the box, chattered like crazy and the clip on one one side broke off less than a year after installation.",Yes,,Not Deleted,,,RADB2N5931DYS
,,B005JU5V6E,US,"Bosch ICON 21A Wiper Blade, Up to 40% Longer Life* - 21"" (Pack of 1)",https://www.amazon.com/gp/customer-reviews/RVJH4KK267TF6,4.0,2014-12-15,https://www.amazon.com/gp/profile/amzn1.account.AGGLNJDEK66RMFJ4CCM3VXGXKZWA/ref=cm_cr_arp_d_gw_btm?ie=UTF8,Ballsar Frozenoff,AGGLNJDEK66RMFJ4CCM3VXGXKZWA,Superb wiper blades but check the Bosch website for proper fitment before you order,"Love these wiper blades! Got a set for my Chevy pickup and my Nissan Altima. Just a word to Altima owners, according to the Bosch website, my 2000 uses a 21A on left side and 20B on the right! I ordered two 21A so I have to sort that out. They are quiet and very efficient.",Yes,,Not Deleted,,,RVJH4KK267TF6
,,B005JU5V6E,US,"Bosch ICON 21A Wiper Blade, Up to 40% Longer Life* - 21"" (Pack of 1)",https://www.amazon.com/gp/customer-reviews/R2R2Y7IKNZ5499,5.0,2014-12-06,https://www.amazon.com/gp/profile/amzn1.account.AG5SCPP336QRQGPVDRRLA4EN262A/ref=cm_cr_arp_d_gw_btm?ie=UTF8,Nada,AG5SCPP336QRQGPVDRRLA4EN262A,Five Stars,Some of the best windhshield wipers I've ever had.,Yes,,Not Deleted,,,R2R2Y7IKNZ5499
,,B005JU5V6E,US,"Bosch ICON 21A Wiper Blade, Up to 40% Longer Life* - 21"" (Pack of 1)",https://www.amazon.com/gp/customer-reviews/R10BDN48WKLY0G,5.0,2014-12-06,https://www.amazon.com/gp/profile/amzn1.account.AGA5VKEFI6PXTR67I7AUQPM3WAXA/ref=cm_cr_arp_d_gw_btm?ie=UTF8,Pushkar Ranjan,AGA5VKEFI6PXTR67I7AUQPM3WAXA,Five Stars,Great build quality...,Yes,,Not Deleted,,,R10BDN48WKLY0G
,,B005JU5V6E,US,"Bosch ICON 21A Wiper Blade, Up to 40% Longer Life* - 21"" (Pack of 1)",https://www.amazon.com/gp/customer-reviews/R6LS2JE8AG125,5.0,2014-12-03,https://www.amazon.com/gp/profile/amzn1.account.AFLPUAJCUNIMXXJWBOJLHLMJV2QQ/ref=cm_cr_arp_d_gw_btm?ie=UTF8,Christopher Dungeon,AFLPUAJCUNIMXXJWBOJLHLMJV2QQ,Hands down the best windshield wipers out there,Hands down the best windshield wipers out there. Buy these once and you will never go back to anything else. Seriously!,Yes,,Not Deleted,,,R6LS2JE8AG125
,,B005JU5V6E,US,"Bosch ICON 21A Wiper Blade, Up to 40% Longer Life* - 21"" (Pack of 1)",https://www.amazon.com/gp/customer-reviews/R6PXF4TF0UDQK,5.0,2014-11-29,https://www.amazon.com/gp/profile/amzn1.account.AEMUWBA55GTVZA4ZGYRZSVVESXUA/ref=cm_cr_arp_d_gw_btm?ie=UTF8,SmartAleck73,AEMUWBA55GTVZA4ZGYRZSVVESXUA,but it fits and works great.,"Bes wipers you can get. Catalog says it won't fit a 2003 AudiTT, but it fits and works great.",Yes,,Not Deleted,,,R6PXF4TF0UDQK
,,B005JU5V6E,US,"Bosch ICON 21A Wiper Blade, Up to 40% Longer Life* - 21"" (Pack of 1)",https://www.amazon.com/gp/customer-reviews/R25FV3IHKAM95Y,5.0,2014-11-23,https://www.amazon.com/gp/profile/amzn1.account.AFDTNOSOBIBMNJF6BRBHAPUC6W6A/ref=cm_cr_arp_d_gw_btm?ie=UTF8,Bart,AFDTNOSOBIBMNJF6BRBHAPUC6W6A,Five Stars,Last 3 years,Yes,,Not Deleted,,,R25FV3IHKAM95Y
,,B005JU5V6E,US,"Bosch ICON 21A Wiper Blade, Up to 40% Longer Life* - 21"" (Pack of 1)",https://www.amazon.com/gp/customer-reviews/R3NBOWXBHJNRQW,5.0,2014-11-19,https://www.amazon.com/gp/profile/amzn1.account.AEAZCSNKPS3MAARY3FXEOFSVXKMA/ref=cm_cr_arp_d_gw_btm?ie=UTF8,G.Honey,AEAZCSNKPS3MAARY3FXEOFSVXKMA,Five Stars,great wiper blade. arrived quickly and works so well!,Yes,,Not Deleted,,,R3NBOWXBHJNRQW
,,B005JU5V6E,US,"Bosch ICON 21A Wiper Blade, Up to 40% Longer Life* - 21"" (Pack of 1)",https://www.amazon.com/gp/customer-reviews/RM2J1LDLT8NOM,5.0,2014-11-19,https://www.amazon.com/gp/profile/amzn1.account.AF33W5A6POAIRVVGUCW765ECQKTA/ref=cm_cr_arp_d_gw_btm?ie=UTF8,JonSnow,AF33W5A6POAIRVVGUCW765ECQKTA,Five Stars,The best wiper blades!,Yes,,Not Deleted,,,RM2J1LDLT8NOM
,,B005JU5V6E,US,"Bosch ICON 21A Wiper Blade, Up to 40% Longer Life* - 21"" (Pack of 1)",https://www.amazon.com/gp/customer-reviews/R18TQ7OWHB2S4Q,5.0,2014-11-18,https://www.amazon.com/gp/profile/amzn1.account.AFDRQDA3HPM4JSWQZVMTE6C5RTRA/ref=cm_cr_arp_d_gw_btm?ie=UTF8,johnny_vindaloo,AFDRQDA3HPM4JSWQZVMTE6C5RTRA,Awesome wipers. Bought a site for my wife as ...,"Awesome wipers.  Bought a site for my wife as an OEM replacement for her VW, and have now bought a set for me.  Won't buy anything else from now on.",Yes,,Not Deleted,,,R18TQ7OWHB2S4Q
,,B005JU5V6E,US,"Bosch ICON 21A Wiper Blade, Up to 40% Longer Life* - 21"" (Pack of 1)",https://www.amazon.com/gp/customer-reviews/R1GL2LIRWF2Y03,5.0,2014-11-14,https://www.amazon.com/gp/profile/amzn1.account.AGFPTDMLZTDNRSEUD4VT3CHRNXCQ/ref=cm_cr_arp_d_gw_btm?ie=UTF8,Scott B.,AGFPTDMLZTDNRSEUD4VT3CHRNXCQ,Five Stars,These are the best wipers and a perfect fit for my 2008 Mazdaspeed3!,Yes,,Not Deleted,,,R1GL2LIRWF2Y03
,,B005JU5V6E,US,"Bosch ICON 21A Wiper Blade, Up to 40% Longer Life* - 21"" (Pack of 1)",https://www.amazon.com/gp/customer-reviews/RDAA45B7PZLJO,5.0,2014-11-08,https://www.amazon.com/gp/profile/amzn1.account.AEDQ4DK4GINHIGVZCC3537EFTOIQ/ref=cm_cr_arp_d_gw_btm?ie=UTF8,SteelSlicer,AEDQ4DK4GINHIGVZCC3537EFTOIQ,Definitely will buy again,"Right after I put these on, I did a 1200 mile round trip in my pickup. It rained all the way there, and half the drive home. I am very happy with these blades, they do an excellent job. And they are way cheaper on Amazon than at the auto parts store.",Yes,,Not Deleted,,,RDAA45B7PZLJO
,,B005JU5V6E,US,"Bosch ICON 21A Wiper Blade, Up to 40% Longer Life* - 21"" (Pack of 1)",https://www.amazon.com/gp/customer-reviews/RTTTNTEYWJMUK,4.0,2014-11-01,https://www.amazon.com/gp/profile/amzn1.account.AHAOJUAQBCLCZPJYBF2CRFI5G2HQ/ref=cm_cr_arp_d_gw_btm?ie=UTF8,Bill H,AHAOJUAQBCLCZPJYBF2CRFI5G2HQ,Four Stars,These are great wiper blades but on the more expensive side. They do last me a couple years though,Yes,,Not Deleted,,,RTTTNTEYWJMUK
,,B005JU5V6E,US,"Bosch ICON 21A Wiper Blade, Up to 40% Longer Life* - 21"" (Pack of 1)",https://www.amazon.com/gp/customer-reviews/R3UEQ9PXFTY60G,5.0,2014-10-31,https://www.amazon.com/gp/profile/amzn1.account.AHSZZP25W2GDQXJ32EBWMPFVE7WQ/ref=cm_cr_arp_d_gw_btm?ie=UTF8,SeaMike,AHSZZP25W2GDQXJ32EBWMPFVE7WQ,Best wiper out there,Best wipers on the market,Yes,,Not Deleted,,,R3UEQ9PXFTY60G
,,B005JU5V6E,US,"Bosch ICON 21A Wiper Blade, Up to 40% Longer Life* - 21"" (Pack of 1)",https://www.amazon.com/gp/customer-reviews/R1EN6KOC58TF05,5.0,2014-10-25,https://www.amazon.com/gp/profile/amzn1.account.AGJJRW67LO2AJ5VFMCQ25BB5VC4Q/ref=cm_cr_arp_d_gw_btm?ie=UTF8,Joe Costa,AGJJRW67LO2AJ5VFMCQ25BB5VC4Q,Best wipers I ever bought.,Best wipers I ever bought.,Yes,,Not Deleted,,,R1EN6KOC58TF05
,,B005JU5V6E,US,"Bosch ICON 21A Wiper Blade, Up to 40% Longer Life* - 21"" (Pack of 1)",https://www.amazon.com/gp/customer-reviews/RLGMD6YG27YI7,5.0,2014-10-24,https://www.amazon.com/gp/profile/amzn1.account.AEDQAFOPPAUY4CELCHOV3FNKSGCQ/ref=cm_cr_arp_d_gw_btm?ie=UTF8,abdulla alkendi,AEDQAFOPPAUY4CELCHOV3FNKSGCQ,the best,Very good,Yes,,Not Deleted,,,RLGMD6YG27YI7
,,B005JU5V6E,US,"Bosch ICON 21A Wiper Blade, Up to 40% Longer Life* - 21"" (Pack of 1)",https://www.amazon.com/gp/customer-reviews/R1DFA2R60B9Z5Y,5.0,2014-10-23,https://www.amazon.com/gp/profile/amzn1.account.AGGTEOCKVIA5SAVLWYZJKTKRTVFA/ref=cm_cr_arp_d_gw_btm?ie=UTF8,Crazy car nut,AGGTEOCKVIA5SAVLWYZJKTKRTVFA,Bosch Icon clean wiping since 2014!!!!!!!!!!!,Just installed them and so far so good. They seem to wipe well without skipping and streaking! Next time I will purchase these at WALMART as they had them for 3-4 dollars less each. Hoping they hold up well for the price I paid!,Yes,,Not Deleted,,,R1DFA2R60B9Z5Y
,,B005JU5V6E,US,"Bosch ICON 21A Wiper Blade, Up to 40% Longer Life* - 21"" (Pack of 1)",https://www.amazon.com/gp/customer-reviews/R33SISEAMZBGXA,5.0,2014-10-03,https://www.amazon.com/gp/profile/amzn1.account.AE4BLF2LQ7HADTNPZ53TWXSVQYGQ/ref=cm_cr_arp_d_gw_btm?ie=UTF8,NmbrdDays,AE4BLF2LQ7HADTNPZ53TWXSVQYGQ,These are great. I prefer these frameless type of blades but ...,These are great. I prefer these frameless type of blades but I've had them in the past and I've tried a few others such as rain-x and none compare to Bosch. These are hands down the best I've ever used. A lil more money than the other but you get what you pay for.,Yes,,Not Deleted,,,R33SISEAMZBGXA
,,B005JU5V6E,US,"Bosch ICON 21A Wiper Blade, Up to 40% Longer Life* - 21"" (Pack of 1)",https://www.amazon.com/gp/customer-reviews/R1CAH49LB5M2JJ,1.0,2014-09-27,https://www.amazon.com/gp/profile/amzn1.account.AELVH7QWQSDPLM6WWC534UNKDRKQ/ref=cm_cr_arp_d_gw_btm?ie=UTF8,J. Griffith,AELVH7QWQSDPLM6WWC534UNKDRKQ,Stick With Factory Wipers,"Stick with your factory windshield wipers, they've gone through the trouble to make sure they fit well to the curvature of your windshield.
Save yourself some money though, and have your dealer (or yourself) replace only the rubber insert rather than the entire wiper arm. The rubber wears out a lot more quickly than the metal wiper arm.",Yes,,Not Deleted,,,R1CAH49LB5M2JJ
